ranking of movie,movie name ,Year,certificate,runtime,genre,RATING,DETAIL ABOUT MOVIE,DIRECTOR ,ACTOR 1,ACTOR 2,ACTOR 3,ACTOR 4,votes,metascore,GROSS COLLECTION
167,Tokyo Story,-1953,Not Rated,136 min,Drama,8.2,"An old couple visit their children and grandchildren in the city, but receive little attention.",Yasujirô Ozu,Chishû Ryû,Chieko Higashiyama,Sô Yamamura,Setsuko Hara,58792,,
168,Rashomon,-1950,Not Rated,88 min,"Crime, Drama, Mystery",8.2,"The rape of a bride and the murder of her samurai husband are recalled from the perspectives of a bandit, the bride, the samurai's ghost and a woodcutter.",Akira Kurosawa,Toshirô Mifune,Machiko Kyô,Masayuki Mori,Takashi Shimura,162274,98,$0.10M
169,All About Eve,-1950,Passed,138 min,Drama,8.2,A seemingly timid but secretly ruthless ingénue insinuates herself into the lives of an aging Broadway star and her circle of theater friends.,Joseph L. Mankiewicz,Bette Davis,Anne Baxter,George Sanders,Celeste Holm,127476,98,$0.01M
170,The Treasure of the Sierra Madre,-1948,Passed,126 min,"Adventure, Drama, Western",8.2,Two down-on-their-luck Americans searching for work in 1920s Mexico convince an old prospector to help them mine for gold in the Sierra Madre Mountains.,John Huston,Humphrey Bogart,Walter Huston,Tim Holt,Bruce Bennett,121182,98,$5.01M
171,To Be or Not to Be,-1942,Passed,99 min,"Comedy, Romance, War",8.2,"During the Nazi occupation of Poland, an acting troupe becomes embroiled in a Polish soldier's efforts to track down a German spy.",Ernst Lubitsch,Carole Lombard,Jack Benny,Robert Stack,Felix Bressart,34727,86,
172,The Gold Rush,-1925,Passed,95 min,"Adventure, Comedy, Drama",8.2,"A prospector goes to the Klondike during the 1890s gold rush in hopes of making his fortune, and is smitten with a girl he sees in a dance hall.",Charles Chaplin,Charles Chaplin,Mack Swain,Tom Murray,Henry Bergman,107737,,$5.45M
173,Sherlock Jr.,-1924,Passed,45 min,"Action, Comedy, Romance",8.2,"A film projectionist longs to be a detective, and puts his meagre skills to work when he is framed by a rival for stealing his girlfriend's father's pocketwatch.",Buster Keaton,Buster Keaton,Kathryn McGuire,Joe Keaton,Erwin Connelly,46967,,$0.98M
174,"Three Billboards Outside Ebbing, Missouri",-2017,R,115 min,"Comedy, Crime, Drama",8.1,A mother personally challenges the local authorities to solve her daughter's murder when they fail to catch the culprit.,Martin McDonagh,Frances McDormand,Woody Harrelson,Sam Rockwell,Caleb Landry Jones,475981,88,$54.51M
175,The Handmaiden,-2016,Not Rated,145 min,"Drama, Romance, Thriller",8.1,"A woman is hired as a handmaiden to a Japanese heiress, but secretly she is involved in a plot to defraud her.",Park Chan-Wook,Kim Min-hee,Ha Jung-woo,Cho Jin-woong,Moon So-ri,132314,84,$2.01M
176,Logan,-2017,R,137 min,"Action, Drama, Sci-Fi",8.1,"In a future where mutants are nearly extinct, an elderly and weary Logan leads a quiet life. But when Laura, a mutant child pursued by scientists, comes to him for help, he must get her to safety.",James Mangold,Hugh Jackman,Patrick Stewart,Dafne Keen,Boyd Holbrook,704205,77,$226.28M
177,Room,(I) (2015),R,118 min,"Drama, Thriller",8.1,"Held captive for 7 years in an enclosed space, a woman and her young son finally gain their freedom, allowing the boy to experience the outside world for the first time.",Lenny Abrahamson,Brie Larson,Jacob Tremblay,Sean Bridgers,Wendy Crewson,398899,86,$14.68M
178,Wild Tales,-2014,R,122 min,"Comedy, Drama, Thriller",8.1,Six short stories that explore the extremities of human behavior involving people in distress.,Damián Szifron,Darío Grandinetti,María Marull,Mónica Villa,Diego Starosta,189591,77,$3.11M
179,The Grand Budapest Hotel,-2014,R,99 min,"Adventure, Comedy, Crime",8.1,"A writer encounters the owner of an aging high-class hotel, who tells him of his early years serving as a lobby boy in the hotel's glorious years under an exceptional concierge.",Wes Anderson,Ralph Fiennes,F. Murray Abraham,Mathieu Amalric,Adrien Brody,760453,88,$59.10M
180,Gone Girl,-2014,R,149 min,"Drama, Mystery, Thriller",8.1,"With his wife's disappearance having become the focus of an intense media circus, a man sees the spotlight turned on him when it's suspected that he may not be innocent.",David Fincher,Ben Affleck,Rosamund Pike,Neil Patrick Harris,Tyler Perry,926047,79,$167.77M
181,Hacksaw Ridge,-2016,R,139 min,"Biography, Drama, History",8.1,"World War II American Army Medic , who served during the Battle of Okinawa, refuses to kill people and becomes the first man in American history to receive the Medal of Honor without firing a shot.",Mel Gibson,Andrew Garfield,Sam Worthington,Luke Bracey,Teresa Palmer,480632,71,$67.21M
182,Inside Out,(I) (2015),PG,95 min,"Animation, Adventure, Comedy",8.1,"After young Riley is uprooted from her Midwest life and moved to San Francisco, her emotions - Joy, Fear, Anger, Disgust and Sadness - conflict on how best to navigate a new city, house, and school.",Pete Docter,Ronnie Del Carmen,Amy Poehler,Bill Hader,Lewis Black,666648,94,$356.46M
183,12 Years a Slave,-2013,R,134 min,"Biography, Drama, History",8.1,"In the antebellum United States, , a free black man from upstate New York, is abducted and sold into slavery.",Steve McQueen,Chiwetel Ejiofor,Michael Kenneth Williams,Michael Fassbender,Brad Pitt,672833,96,$56.67M
184,Rush,(I) (2013),R,123 min,"Action, Biography, Drama",8.1,The merciless 1970s rivalry between Formula One rivals  and .,Ron Howard,Daniel Brühl,Chris Hemsworth,Olivia Wilde,Alexandra Maria Lara,459118,74,$26.95M
185,Ford v Ferrari,-2019,PG-13,152 min,"Action, Biography, Drama",8.1,American car designer  and driver  battle corporate interference and the laws of physics to build a revolutionary race car for Ford in order to defeat Ferrari at the 24 Hours of Le Mans in 1966.,James Mangold,Matt Damon,Christian Bale,Jon Bernthal,Caitriona Balfe,348224,81,$117.62M
186,Spotlight,(I) (2015),R,129 min,"Biography, Crime, Drama",8.1,"The true story of how the Boston Globe uncovered the massive scandal of child molestation and cover-up within the local Catholic Archdiocese, shaking the entire Catholic Church to its core.",Tom McCarthy,Mark Ruffalo,Michael Keaton,Rachel McAdams,Liev Schreiber,449414,93,$45.06M
187,Prisoners,-2013,R,153 min,"Crime, Drama, Mystery",8.1,"When Keller Dover's daughter and her friend go missing, he takes matters into his own hands as the police pursue multiple leads and the pressure mounts.",Denis Villeneuve,Hugh Jackman,Jake Gyllenhaal,Viola Davis,Melissa Leo,654280,70,$61.00M
188,Mad Max: Fury Road,-2015,R,120 min,"Action, Adventure, Sci-Fi",8.1,"In a post-apocalyptic wasteland, a woman rebels against a tyrannical ruler in search for her homeland with the aid of a group of female prisoners, a psychotic worshiper, and a drifter named Max.",George Miller,Tom Hardy,Charlize Theron,Nicholas Hoult,Zoë Kravitz,944613,90,$154.06M
189,Warrior,-2011,PG-13,140 min,"Action, Drama, Sport",8.1,"The youngest son of an alcoholic former boxer returns home, where he's trained by his father for competition in a mixed martial arts tournament - a path that puts the fighter on a collision course with his estranged, older brother.",Gavin O'Connor,Tom Hardy,Nick Nolte,Joel Edgerton,Jennifer Morrison,454687,71,$13.66M
190,Gran Torino,-2008,R,116 min,Drama,8.1,"Disgruntled Korean War veteran Walt Kowalski sets out to reform his neighbor, Thao Lor, a Hmong teenager who tried to steal Kowalski's prized possession: a 1972 Gran Torino.",Clint Eastwood,Clint Eastwood,Bee Vang,Christopher Carley,Ahney Her,749991,72,$148.10M
191,Harry Potter and the Deathly Hallows: Part 2,-2011,PG-13,130 min,"Adventure, Fantasy, Mystery",8.1,"Harry, Ron, and Hermione search for Voldemort's remaining Horcruxes in their effort to destroy the Dark Lord as the final battle rages on at Hogwarts.",David Yates,Daniel Radcliffe,Emma Watson,Rupert Grint,Michael Gambon,818892,85,$381.01M
192,Hachi: A Dog's Tale,-2009,G,93 min,"Biography, Drama, Family",8.1,A college professor bonds with an abandoned dog he takes into his home.,Lasse Hallström,Richard Gere,Joan Allen,Cary-Hiroyuki Tagawa,Sarah Roemer,270784,,
193,Mary and Max,-2009,Not Rated,92 min,"Animation, Comedy, Drama",8.1,"A tale of friendship between two unlikely pen pals: Mary, a lonely, eight-year-old girl living in the suburbs of Melbourne, and Max, a forty-four-year old, severely obese man living in New York.",Adam Elliot,Toni Collette,Philip Seymour Hoffman,Eric Bana,Barry Humphries,172456,,
194,How to Train Your Dragon,-2010,PG,98 min,"Animation, Action, Adventure",8.1,"A hapless young Viking who aspires to hunt dragons becomes the unlikely friend of a young dragon himself, and learns there may be more to the creatures than he assumed.",Dean DeBlois,Chris Sanders,Jay Baruchel,Gerard Butler,Christopher Mintz-Plasse,703537,75,$217.58M
195,Into the Wild,-2007,R,148 min,"Adventure, Biography, Drama",8.1,"After graduating from Emory University, top student and athlete Christopher McCandless abandons his possessions, gives his entire $24,000 savings account to charity and hitchhikes to Alaska to live in the wilderness. Along the way, Christopher encounters a series of characters that shape his life.",Sean Penn,Emile Hirsch,Vince Vaughn,Catherine Keener,Marcia Gay Harden,601693,73,$18.35M
196,No Country for Old Men,-2007,R,122 min,"Crime, Drama, Thriller",8.1,Violence and mayhem ensue after a hunter stumbles upon a drug deal gone wrong and more than two million dollars in cash near the Rio Grande.,Ethan Coen,Joel Coen,Tommy Lee Jones,Javier Bardem,Josh Brolin,917570,91,$74.28M
197,V for Vendetta,-2005,R,132 min,"Action, Drama, Sci-Fi",8.1,"In a future British tyranny, a shadowy freedom fighter, known only by the alias of ""V,"" plots to overthrow it with the help of a young woman.",James McTeigue,Hugo Weaving,Natalie Portman,Rupert Graves,Stephen Rea,1081061,62,$70.51M
198,Million Dollar Baby,-2004,PG-13,132 min,"Drama, Sport",8.1,A determined woman works with a hardened boxing trainer to become a professional.,Clint Eastwood,Hilary Swank,Clint Eastwood,Morgan Freeman,Jay Baruchel,664634,86,$100.49M
199,Hotel Rwanda,-2004,PG-13,121 min,"Biography, Drama, History",8.1,", a hotel manager, houses over a thousand Tutsi refugees during their struggle against the Hutu militia in Rwanda, Africa.",Terry George,Don Cheadle,Sophie Okonedo,Joaquin Phoenix,Xolani Mali,346603,79,$23.53M
200,Before Sunset,-2004,R,80 min,"Drama, Romance",8.1,"Nine years after Jesse and Celine first met, they encounter each other again on the French leg of Jesse's book tour.",Richard Linklater,Ethan Hawke,Julie Delpy,Vernon Dobtcheff,Louise Lemoine Torrès,251581,90,$5.82M
201,Memories of Murder,-2003,Not Rated,132 min,"Crime, Drama, Mystery",8.1,"In a small Korean province in 1986, two detectives struggle with the case of multiple young women being found raped and murdered by an unknown culprit.",Bong Joon Ho,Kang-ho Song,Kim Sang-kyung,Roe-ha Kim,Jae-ho Song,164706,82,$0.01M
202,Kill Bill: Vol. 1,-2003,R,111 min,"Action, Crime, Drama",8.1,"After awakening from a four-year coma, a former assassin wreaks vengeance on the team of assassins who betrayed her.",Quentin Tarantino,Uma Thurman,David Carradine,Daryl Hannah,Michael Madsen,1061744,69,$70.10M
203,Finding Nemo,-2003,G,100 min,"Animation, Adventure, Comedy",8.1,"After his son is captured in the Great Barrier Reef and taken to Sydney, a timid clownfish sets out on a journey to bring him home.",Andrew Stanton,Lee Unkrich,Albert Brooks,Ellen DeGeneres,Alexander Gould,996746,90,$380.84M
204,Catch Me If You Can,-2002,PG-13,141 min,"Biography, Crime, Drama",8.1,"Barely 21 yet, Frank is a skilled forger who has passed as a doctor, lawyer and pilot. FBI agent Carl becomes obsessed with tracking down the con man, who only revels in the pursuit.",Steven Spielberg,Leonardo DiCaprio,Tom Hanks,Christopher Walken,Martin Sheen,907766,75,$164.62M
205,Amores perros,-2000,R,154 min,"Drama, Thriller",8.1,"A horrific car accident connects three stories, each involving characters dealing with loss, regret, and life's harsh realities, all in the name of love.",Alejandro G. Iñárritu,Emilio Echevarría,Gael García Bernal,Goya Toledo,Álvaro Guerrero,234220,83,$5.38M
206,"Monsters, Inc.",-2001,G,92 min,"Animation, Adventure, Comedy",8.1,"In order to power the city, monsters have to scare children so that they scream. However, the children are toxic to the monsters, and after a child gets through, two monsters realize things may not be what they think.",Pete Docter,David Silverman,Lee Unkrich,Billy Crystal,John Goodman,863317,79,$289.92M
207,Neon Genesis Evangelion: The End of Evangelion,-1997,TV-MA,87 min,"Animation, Action, Drama",8.1,Concurrent theatrical ending of the TV series  (1995).,Hideaki Anno,Kazuya Tsurumaki,Megumi Ogata,Megumi Hayashibara,Yûko Miyamura,49072,,
208,The Sixth Sense,-1999,PG-13,107 min,"Drama, Mystery, Thriller",8.1,"A frightened, withdrawn Philadelphia boy who communicates with spirits seeks the help of a disheartened child psychologist.",M. Night Shyamalan,Bruce Willis,Haley Joel Osment,Toni Collette,Olivia Williams,952624,64,$293.51M
209,The Truman Show,-1998,PG,103 min,"Comedy, Drama",8.1,An insurance salesman discovers his whole life is actually a reality TV show.,Peter Weir,Jim Carrey,Ed Harris,Laura Linney,Noah Emmerich,1007350,90,$125.62M
210,The Big Lebowski,-1998,R,117 min,"Comedy, Crime, Sport",8.1,"Ultimate L.A. slacker Jeff ""The Dude"" Lebowski, mistaken for a millionaire of the same name, seeks restitution for a rug ruined by debt collectors, enlisting his bowling buddies for help while trying to find the millionaire's missing wife.",Joel Coen,Ethan Coen,Jeff Bridges,John Goodman,Julianne Moore,775912,71,$17.50M
211,In the Mood for Love,-2000,PG,98 min,"Drama, Romance",8.1,"Two neighbors form a strong bond after both suspect extramarital activities of their spouses. However, they agree to keep their bond platonic so as not to commit similar wrongs.",Kar-Wai Wong,Tony Chiu-Wai Leung,Maggie Cheung,Siu Ping-Lam,Tung Cho 'Joe' Cheung,140230,85,$2.73M
212,Trainspotting,-1996,R,93 min,Drama,8.1,"Renton, deeply immersed in the Edinburgh drug scene, tries to clean up and get out, despite the allure of the drugs and influence of friends.",Danny Boyle,Ewan McGregor,Ewen Bremner,Jonny Lee Miller,Kevin McKidd,663132,83,$16.50M
213,Fargo,-1996,R,98 min,"Crime, Thriller",8.1,Minnesota car salesman Jerry Lundegaard's inept crime falls apart due to his and his henchmen's bungling and the persistent police work of the quite pregnant Marge Gunderson.,Joel Coen,Ethan Coen,William H. Macy,Frances McDormand,Steve Buscemi,651412,85,$24.61M
214,La Haine,-1995,Not Rated,98 min,"Crime, Drama",8.1,24 hours in the lives of three young men in the French suburbs the day after a violent riot.,Mathieu Kassovitz,Vincent Cassel,Hubert Koundé,Saïd Taghmaoui,Abdel Ahmed Ghili,163350,,$0.31M
215,Before Sunrise,-1995,R,101 min,"Drama, Romance",8.1,"A young man and woman meet on a train in Europe, and wind up spending one evening together in Vienna. Unfortunately, both know that this will probably be their only night together.",Richard Linklater,Ethan Hawke,Julie Delpy,Andrea Eckert,Hanno Pöschl,291507,77,$5.54M
216,Jurassic Park,-1993,PG-13,127 min,"Action, Adventure, Sci-Fi",8.1,A pragmatic paleontologist touring an almost complete theme park on an island in Central America is tasked with protecting a couple of kids after a power failure causes the park's cloned dinosaurs to run loose.,Steven Spielberg,Sam Neill,Laura Dern,Jeff Goldblum,Richard Attenborough,923629,68,$402.45M
217,In the Name of the Father,-1993,R,133 min,"Biography, Crime, Drama",8.1,A man's coerced confession to an I.R.A. bombing he did not commit results in the imprisonment of his father as well. An English lawyer fights to free them.,Jim Sheridan,Daniel Day-Lewis,Pete Postlethwaite,Alison Crosbie,Philip King,168046,84,$25.01M
218,Dead Poets Society,-1989,PG,128 min,"Comedy, Drama",8.1,Maverick teacher John Keating uses poetry to embolden his boarding school students to new heights of self-expression.,Peter Weir,Robin Williams,Robert Sean Leonard,Ethan Hawke,Josh Charles,457898,79,$95.86M
219,The Princess Bride,-1987,PG,98 min,"Adventure, Family, Fantasy",8.1,"While homesick in bed, a young boy's grandfather reads him the story of a farmboy-turned-pirate who encounters numerous obstacles, enemies and allies in his quest to be reunited with his true love.",Rob Reiner,Cary Elwes,Mandy Patinkin,Robin Wright,Chris Sarandon,414569,77,$30.86M
220,Stand by Me,-1986,R,89 min,"Adventure, Drama",8.1,"After the death of one of his friends, a writer recounts a childhood journey with his friends to find the body of a missing boy.",Rob Reiner,Wil Wheaton,River Phoenix,Corey Feldman,Jerry O'Connell,384651,75,$52.29M
221,Platoon,-1986,R,120 min,"Drama, War",8.1,"Chris Taylor, a neophyte recruit in Vietnam, finds himself caught in a battle of wills between two sergeants, one good and the other evil. A shrewd examination of the brutality of war and the duality of man in conflict.",Oliver Stone,Charlie Sheen,Tom Berenger,Willem Dafoe,Keith David,399645,92,$138.53M
222,"Paris, Texas",-1984,R,145 min,Drama,8.1,"Travis Henderson, an aimless drifter who has been missing for four years, wanders out of the desert and must reconnect with society, himself, his life, and his family.",Wim Wenders,Harry Dean Stanton,Nastassja Kinski,Dean Stockwell,Sam Berry,101352,78,$2.18M
223,Nausicaä of the Valley of the Wind,-1984,PG,117 min,"Animation, Adventure, Sci-Fi",8.1,Warrior and pacifist Princess Nausicaä desperately struggles to prevent two warring nations from destroying themselves and their dying planet.,Hayao Miyazaki,Sumi Shimamoto,Mahito Tsujimura,Hisako Kyôda,Gorô Naya,162659,86,$0.50M
224,The Thing,-1982,R,109 min,"Horror, Mystery, Sci-Fi",8.1,A research team in Antarctica is hunted by a shape-shifting alien that assumes the appearance of its victims.,John Carpenter,Kurt Russell,Wilford Brimley,Keith David,Richard Masur,400109,57,$13.78M
225,Fanny and Alexander,-1982,R,188 min,Drama,8.1,"Two young Swedish children in the 1900s experience the many comedies and tragedies of their lively and affectionate theatrical family, the Ekdahls.",Ingmar Bergman,Bertil Guve,Pernilla Allwin,Kristina Adolphson,Börje Ahlstedt,62011,100,$4.97M
226,Blade Runner,-1982,R,117 min,"Action, Drama, Sci-Fi",8.1,"A blade runner must pursue and terminate four replicants who stole a ship in space, and have returned to Earth to find their creator.",Ridley Scott,Harrison Ford,Rutger Hauer,Sean Young,Edward James Olmos,734033,84,$32.87M
227,The Elephant Man,-1980,PG,124 min,"Biography, Drama",8.1,"A Victorian surgeon rescues a heavily disfigured man who is mistreated while scraping a living as a side-show freak. Behind his monstrous façade, there is revealed a person of kindness, intelligence and sophistication.",David Lynch,Anthony Hopkins,John Hurt,Anne Bancroft,John Gielgud,233182,78,
228,Stalker,-1979,Not Rated,162 min,"Drama, Sci-Fi",8.1,A guide leads two men through an area known as the Zone to find a room that grants wishes.,Andrei Tarkovsky,Alisa Freyndlikh,Aleksandr Kaydanovskiy,Anatoliy Solonitsyn,Nikolay Grinko,128582,,$0.23M
229,Life of Brian,-1979,R,94 min,Comedy,8.1,"Born on the original Christmas in the stable next door to , Brian of Nazareth spends his life being mistaken for a messiah.",Terry Jones,Graham Chapman,John Cleese,Michael Palin,Terry Gilliam,386145,77,$20.05M
230,The Deer Hunter,-1978,R,183 min,"Drama, War",8.1,An in-depth examination of the ways in which the Vietnam War impacts and disrupts the lives of several friends in a small steel mill town in Pennsylvania.,Michael Cimino,Robert De Niro,Christopher Walken,John Cazale,John Savage,328205,86,$48.98M
231,Rocky,-1976,PG,120 min,"Drama, Sport",8.1,A small-time Philadelphia boxer gets a supremely rare chance to fight the world heavyweight champion in a bout in which he strives to go the distance for his self-respect.,John G. Avildsen,Sylvester Stallone,Talia Shire,Burt Young,Carl Weathers,547820,70,$117.24M
232,Network,-1976,R,121 min,Drama,8.1,"A television network cynically exploits a deranged former anchor's ravings and revelations about the news media for its own profit, but finds that his message may be difficult to control.",Sidney Lumet,Faye Dunaway,William Holden,Peter Finch,Robert Duvall,154012,83,
233,Barry Lyndon,-1975,PG,185 min,"Adventure, Drama, History",8.1,An Irish rogue wins the heart of a rich widow and assumes her dead husband's aristocratic position in 18th-century England.,Stanley Kubrick,Ryan O'Neal,Marisa Berenson,Patrick Magee,Hardy Krüger,160689,89,
234,Cool Hand Luke,-1967,GP,127 min,"Crime, Drama",8.1,"A laid back Southern man is sentenced to two years in a rural prison, but refuses to conform.",Stuart Rosenberg,Paul Newman,George Kennedy,Strother Martin,J.D. Cannon,171897,92,$16.22M
235,Persona,-1966,Not Rated,83 min,"Drama, Thriller",8.1,A nurse is put in charge of a mute actress and finds that their personae are melding together.,Ingmar Bergman,Bibi Andersson,Liv Ullmann,Margaretha Krook,Gunnar Björnstrand,112661,86,
236,Andrei Rublev,-1966,R,205 min,"Biography, Drama, History",8.1,"The life, times and afflictions of the fifteenth-century Russian iconographer St. Andrei Rublev.",Andrei Tarkovsky,Anatoliy Solonitsyn,Ivan Lapikov,Nikolay Grinko,Nikolay Sergeev,51743,,$0.10M
237,The Battle of Algiers,-1966,Not Rated,121 min,"Drama, War",8.1,"In the 1950s, fear and violence escalate as the people of Algiers fight for independence from the French government.",Gillo Pontecorvo,Brahim Hadjadj,Jean Martin,Yacef Saadi,Samia Kerbash,57755,96,$0.06M
238,The 400 Blows,-1959,Not Rated,99 min,"Crime, Drama",8.1,"A young boy, left without attention, delves into a life of petty crime.",François Truffaut,Jean-Pierre Léaud,Albert Rémy,Claire Maurier,Guy Decomble,113069,,
239,Ben-Hur,-1959,G,212 min,"Adventure, Drama, History",8.1,"After a Jewish prince is betrayed and sent into slavery by a Roman friend in 1st-century Jerusalem, he regains his freedom and comes back for revenge.",William Wyler,Charlton Heston,Jack Hawkins,Stephen Boyd,Haya Harareet,231193,90,$74.70M
240,Nights of Cabiria,-1957,Not Rated,110 min,Drama,8.1,A waifish prostitute wanders the streets of Rome looking for true love but finds only heartbreak.,Federico Fellini,Giulietta Masina,François Périer,Franca Marzi,Dorian Gray,47031,,$0.75M
241,The Bridge on the River Kwai,-1957,PG,161 min,"Adventure, Drama, War",8.1,"British POWs are forced to build a railway bridge across the river Kwai for their Japanese captors in occupied Burma, not knowing that the allied forces are planning a daring commando raid through the jungle to destroy it.",David Lean,William Holden,Alec Guinness,Jack Hawkins,Sessue Hayakawa,213585,87,$44.91M
242,On the Waterfront,-1954,Approved,108 min,"Crime, Drama, Thriller",8.1,"An ex-prize fighter turned New Jersey longshoreman struggles to stand up to his corrupt union bosses, including his older brother, as he starts to connect with the grieving sister of one of the syndicate's victims.",Elia Kazan,Marlon Brando,Karl Malden,Lee J. Cobb,Rod Steiger,150148,91,$9.60M
243,The Wages of Fear,-1953,Not Rated,131 min,"Adventure, Drama, Thriller",8.1,"In a decrepit South American village, four men are hired to transport an urgent nitroglycerine shipment without the equipment that would make it safe.",Henri-Georges Clouzot,Yves Montand,Charles Vanel,Peter van Eyck,Folco Lulli,58949,85,
244,The Third Man,-1949,Approved,93 min,"Film-Noir, Mystery, Thriller",8.1,"Pulp novelist Holly Martins travels to shadowy, postwar Vienna, only to find himself investigating the mysterious death of an old friend, Harry Lime.",Carol Reed,Orson Welles,Joseph Cotten,Alida Valli,Trevor Howard,167084,97,$0.45M
245,Rebecca,-1940,Approved,130 min,"Drama, Film-Noir, Mystery",8.1,A self-conscious woman juggles adjusting to her new role as an aristocrat's wife and avoiding being intimidated by his first wife's spectral presence.,Alfred Hitchcock,Laurence Olivier,Joan Fontaine,George Sanders,Judith Anderson,132700,86,$4.36M
246,Mr. Smith Goes to Washington,-1939,Passed,129 min,"Comedy, Drama",8.1,"A naive youth leader is appointed to fill a vacancy in the U.S. Senate. His idealistic plans promptly collide with corruption at home and subterfuge from his hero in Washington, but he tries to forge ahead despite attacks on his character.",Frank Capra,James Stewart,Jean Arthur,Claude Rains,Edward Arnold,112642,73,$9.60M
247,Gone with the Wind,-1939,Passed,238 min,"Drama, History, Romance",8.1,The manipulative daughter of a Georgia plantation owner conducts a turbulent romance with a roguish profiteer during the American Civil War and Reconstruction periods.,Victor Fleming,George Cukor,Sam Wood,Clark Gable,Vivien Leigh,304725,97,$198.68M
248,It Happened One Night,-1934,Passed,105 min,"Comedy, Romance",8.1,"A renegade reporter trailing a young runaway heiress for a big story joins her on a bus heading from Florida to New York, and they end up stuck with each other when the bus leaves them behind at one of the stops.",Frank Capra,Clark Gable,Claudette Colbert,Walter Connolly,Roscoe Karns,100198,87,$4.36M
249,The Passion of Joan of Arc,-1928,Passed,114 min,"Biography, Drama, History",8.1,"In 1431, Jeanne d'Arc is placed on trial on charges of heresy. The ecclesiastical jurists attempt to force Jeanne to recant her claims of holy visions.",Carl Theodor Dreyer,Maria Falconetti,Eugene Silvain,André Berley,Maurice Schutz,52264,,$0.02M
