name,price,description,host,rating,duration,lectures,level,url
"Introduction to AI, Machine Learning and Data Science 2021",455,"Introductory Course for Beginners to AI, Machine Learning, Data Science, Deep Learning, Supervised and Unsupervised ML",Pradeep D,3.6,32 total mins,15 lectures,Beginner,https://www.udemy.com/course/introduction-to-ai-machine-learning-and-data-science/
Data Science A-Z : Machine Learning with Python & R,455,By Data Scientist / IITian for Beginners . Data Science/Machine Learning with Python & R for beginners to advance,Arpan Gupta,3.6,12.5 total hours,90 lectures,All Levels,https://www.udemy.com/course/machine-learning-using-r/
Introduction To Data Science,455,Use the R Programming Language to execute data science projects and become a data scientist.,"Nina Zumel, John Mount",3.6,6 total hours,28 lectures,Intermediate,https://www.udemy.com/course/introduction-to-data-science/
SQL for Data Analysis and Data Science in 2021,455,"SQL by SQL example, SQL Challenges& SQL Final Exam using Real World SQL Database for Data Science & Data Analysis",Tamer Ahmed,3.7,5.5 total hours,114 lectures,All Levels,https://www.udemy.com/course/sql-course-for-data-science/
The 2021 Absolute Beginners Guide to Data Science,455,Build your mathematics and statistics foundations strongly and ensure your Data science fundamentals are in place!,Sai Acuity Institute of Learning Pvt Ltd Enabling Learning Through Insight!,3.7,41.5 total hours,50 lectures,Beginner,https://www.udemy.com/course/the-absolute-beginners-guide-to-data-science/
R Programming Hands-on Specialization for Data Science (Lv1),455,An in-depth course on R language with real-world Data Science examples to supercharge your R data analysis skills,Irfan Elahi,3.7,11 total hours,87 lectures,Beginner,https://www.udemy.com/course/r-programming-data-science-hands-on-course/
What is Data Science?,455,Build your mathematics and statistics foundations strongly and ensure your Data science fundamentals are in place!,Sai Acuity Institute of Learning Pvt Ltd Enabling Learning Through Insight!,3.8,4.5 total hours,8 lectures,All Levels,https://www.udemy.com/course/what-is-data-science-r/
Python for Data Science and Data Analysis Masterclass: 2021,455,"Learn Python for Data Science, Machine Learning, Deep Learning & Data Analysis, Hand's on NumPy, Pandas and Matplotlib !",Vijay Gadhave,3.9,6.5 total hours,51 lectures,All Levels,https://www.udemy.com/course/python-for-data-science-and-data-analysis-masterclass-2020/
Data Science with Python Certification Training and Project,566,Start your career as Data Scientist from scratch. Learn Data Science with Python. Predict trends with advanced analytics,Uplatz Training,3.9,44.5 total hours,56 lectures,All Levels,https://www.udemy.com/course/data-science-with-python-certification-training/
Colors for Data Science A-Z: Data Visualization Color Theory,455,Learn how to apply colour theory to improve your Data Science & Analytics data visualisations and presentations,"Kirill Eremenko, Patrycja Angelika Jeleniewicz, Ligency Team",4,4 total hours,34 lectures,All Levels,https://www.udemy.com/course/colordata/
Data Science and Machine Learning with Python and Libraries,455,"Learn Data Science and Machine Learning with Python and Libraries such as Numpy, Matplotlib, Pandas and much more",The Tech X Learners,4,7 total hours,74 lectures,Beginner,https://www.udemy.com/course/data-science-and-machine-learning-with-python-and-libraries-t/
R Programming:For Data Science With Real Exercises,455,"Learn Programming In R And R Studio. Data Analytics, Data Science, Statistical Analysis, Packages, Functions, GGPlot2",Zulqarnain Hayat,4,5 total hours,27 lectures,All Levels,https://www.udemy.com/course/r-language-with-hands-on-experience/
Data Science with R - Beginners,455,This training is an introduction to the concept of Data science and its application using R programming language,SimpliCode Point,4,6 total hours,56 lectures,All Levels,https://www.udemy.com/course/data-science-with-r-beginners/
Data Science Course 2021: Complete Machine Learning Training,455,"Build a Career in Artificial Intelligence (AI). Hands-on Training with ""7 Stages of Machine Learning"" Framework.",Data-Driven Science,4.1,19 total hours,218 lectures,All Levels,https://www.udemy.com/course/datadrivenscience-machinelearning/
Introduction To Data Science,455,Data Science from the very basics,Sahla Ali,4.1,1 total hour,19 lectures,Intermediate,https://www.udemy.com/course/introduction-to-data-science-basics/
Statistics for Data Science using Python,455,"Statistics you need in the office: Core of Statistics, Inferential & Descriptive statistics, Hypothesis testing,",Shan Singh,4.1,8 total hours,47 lectures,All Levels,https://www.udemy.com/course/statistics-a-z/
A Beginner's Guide to Machine Learning (in Python),455,"Learn supervised learning for structured data, and implement them using Python programming",Curiosity for Data Science,4.1,3.5 total hours,49 lectures,All Levels,https://www.udemy.com/course/a-beginners-guide-to-data-mining/
"Python required for AI, Machine Learning & Data Science 2021",566,"numpy, pandas, matplotlib, seaborn, machine learning, data science, Data Visualization, artificial intelligence, python",Pradeep D,4.1,3 total hours,38 lectures,Beginner,https://www.udemy.com/course/python-for-data-science-and-machine-learning/
Python for Data Science and Machine Learning,"1,920",A Practical Approach Learn by Implementing,Kumar Rajmani Bapat,4.1,7 total hours,19 lectures,All Levels,https://www.udemy.com/course/python-for-data-science-and-machine-learning-pdml/
Python Bootcamp 2021 Build 15 working Applications and Games,455,"Learn complete python with basics, data science, data visualisation, desktop graphical applications and python for web.",Dev Nirwal,4.2,32 total hours,378 lectures,All Levels,https://www.udemy.com/course/python-complete-bootcamp-2019-learn-by-applying-knowledge/
Python-Introduction to Data Science and Machine learning A-Z,455,Python basics Learn Python for Data Science Python For Machine learning and Python Tips and tricks,Yassin Marco,4.2,7.5 total hours,51 lectures,Beginner,https://www.udemy.com/course/python-introduction-to-data-science-and-machine-learning-a-z/
"Learn Data Science Deep Learning, Machine Learning NLP & R",455,"Learn Data Science, Deep Learning, Machine Learning, Natural Language Processing, R and Python Language with libraries",Cinnamon TechX,4.2,70.5 total hours,620 lectures,All Levels,https://www.udemy.com/course/learn-data-science-deep-learning-machine-learning-nlp-r/
Python & Introduction to Data Science,819,Learn the basics of Python and the most important Data Science libraries with this step by step guide!,AI 4 MY,4.2,9 total hours,68 lectures,Beginner,https://www.udemy.com/course/python-introduction-to-data-science/
Docker Masterclass for Machine Learning and Data Science,455,Learn how to containerize and deploy your ML projects with Docker,"Jordan Sauchuk, Ligency Team",4.2,4.5 total hours,82 lectures,All Levels,https://www.udemy.com/course/docker-masterclass-for-machine-learning-and-data-science/
Statistics & Applied Data Science - Business Data Analysis,566,"Data Science Statistics : Data Science from Scratch for Beginners : Data Analysis Techniques, Method Course : Analytics",Mahmoud Ali,4.2,9 total hours,272 lectures,All Levels,https://www.udemy.com/course/ureadup_sds/
Ultimate Python Bootcamp For Data Science & Machine Learning,455,"Learn How To Code Python For Data Science, ML & Data Analysis, With 100+ Exercises and 4 Real Life Projects !",Pruthviraja L,4.2,16 total hours,103 lectures,All Levels,https://www.udemy.com/course/data-analysis-with-pandas-a-complete-tutorial/
Data Science and Machine Learning For Beginners with Python,455,"Learn to Analyse , Make Predictions, Explore data Frames,Clean and Visualize Data",Bluelime Learning Solutions,4.2,8 total hours,78 lectures,Beginner,https://www.udemy.com/course/data-science-and-machine-learning-for-beginners-with-python-c/
Complete Data Science & Machine Learning Bootcamp in Python,566,"Learn Python,NumPy,Pandas,Matplotlib,Seaborn,Scikit-learn,Dask,LightGBM,XGBoost,CatBoost,Streamlit,Power BI & much more","Derrick Mwiti, Namespace Labs",4.2,18 total hours,366 lectures,All Levels,https://www.udemy.com/course/data-science-bootcamp-in-python/
Beginning with Machine Learning & Data Science in Python,455,"Fundamentals of Data Science : Exploratory Data Analysis (EDA), Regression (Linear & logistic), Visualization, Basic ML",UNP United Network of Professionals,4.2,3.5 total hours,49 lectures,Beginner,https://www.udemy.com/course/jumpstart-to-data-science-machine-learning-using-python/
Complete Data Wrangling & Data Visualisation With Python,455,"Learn to Preprocess, Wrangle and Visualise Data For Practical Data Science Applications in Python",Minerva Singh,4.2,6 total hours,52 lectures,All Levels,https://www.udemy.com/course/complete-data-wrangling-data-visualisation-with-python/
Full Stack Data Science Course - Become a Data Scientist,455,Master the four major areas of Data Science and become a Full Stack Data Scientist in 2021.,"The Click Reader, Merishna Singh Suwal",4.2,2 total hours,33 lectures,All Levels,https://www.udemy.com/course/full-stack-data-science-course/
Learn Big Data(Spark) for Data Science–Machine Learning &NLP,455,"Learn Big Data - Hadoop-Spark/PySpark & Data Science from basics of Stats,Machine Learning,NLP using Spark :AllLevels",Srini E,4.2,22 total hours,127 lectures,All Levels,https://www.udemy.com/course/learn-bigdata-spark-for-datascience-machinelearning-nlp/
Tensorflow Deep Learning - Data Science in Python,455,Tensorflow Deep Learning Python : Tensorflow Neural Network Training : Tensorflow Models - Android Java : Tensorflow C#,Minerva Singh,4.2,7 total hours,69 lectures,All Levels,https://www.udemy.com/course/tensorflow-bootcamp-for-data-science-in-python/
Python Programming for Beginners in Data Science,455,"This Python for beginners course teaches you ""just enough"" python training online with Python 3 for Data Science",Ajay Tech,4.3,14 total hours,105 lectures,Beginner,https://www.udemy.com/course/just-enough-python/
Python for Data Science and Machine Learning beginners,585,"A Complete Machine learning Bootcamp learn Numpy, Pandas, Matplotlib, Stats, Plotly , EDA , Scikit-learn and more!",Jay Bhatt,4.3,7.5 total hours,64 lectures,Beginner,https://www.udemy.com/course/python-for-data-science-and-machine-learning-beginners/
2021 Data Science/MachineLearning Project Deployment Mastery,455,"Learn Data Science/ML with 20+Practical Hands-On Projects and Deployment.(Flask,Heroku,AWS,Google Cloud,Microsoft Azure)",MrBriit .,4.3,48.5 total hours,168 lectures,All Levels,https://www.udemy.com/course/data-science-and-machine-learning-projects-mastery/
Data Science Real World Projects in Python,455,"Solve 3 real Business Problems, Build Robust AI, Ml , NLP and Time Series models for Airline, Security & Stock Domain..",Shan Singh,4.3,8.5 total hours,54 lectures,All Levels,https://www.udemy.com/course/data-science-real-world-projects-in-python-x/
Introduction to Data Science,455,"An overview of modern data science: the practice of obtaining, exploring, modeling, and interpreting data.",Data Hawk Tech,4.3,3 total hours,39 lectures,All Levels,https://www.udemy.com/course/learn-data-science/
Python and Data Science for beginners,455,Learn hands-on data science and Python from scratch,Bluelime Learning Solutions,4.3,4.5 total hours,39 lectures,Beginner,https://www.udemy.com/course/introduction-to-data-science-with-python-for-beginners/
Data Analysis Bootcamp™ 21 Real World Case Studies,455,"Gain Business Intelligence Skills using Statistics, Data Wrangling, Data Science, Visualizations & Google Data Studio","Rajeev D. Ratan, Nidia Sahjara",4.3,15 total hours,129 lectures,Beginner,https://www.udemy.com/course/the-data-analyst-bootcamp/
Data Science Masterclass With R 8 Case Studies + 4 Projects,455,"Data Science by IITian -Data Science+R Programming ,Data analysis, Data Visualization, Data Pre-processing etc",Up Degree,4.3,32 total hours,261 lectures,All Levels,https://www.udemy.com/course/data-science-complete-course/
Probability for Statistics and Data Science,455,"Probability for improved business decisions: Introduction, Combinatorics, Bayesian Inference, Distributions",365 Careers,4.3,3.5 total hours,46 lectures,All Levels,https://www.udemy.com/course/probability-for-statistics-and-data-science/
Alteryx: Data Science for Non-Scientists,"1,920","Designed specifically for beginners with no background in Data Science, Computer Science or Alteryx",Jed Guinto,4.3,5 total hours,36 lectures,All Levels,https://www.udemy.com/course/alteryx-mastery/
Data Science: Beginners Guide to the Command Line,455,Master the Basics of the Command Line and Prepare for a Career in Data Science!,Ben Weinstein,4.3,1.5 total hours,32 lectures,All Levels,https://www.udemy.com/course/data-science-beginners-guide-to-the-command-line/
Python for Data Science,455,"An introductory to intermediate level program in Python, and how to apply it in data science","Starweaver Team, Paul Siegel",4.3,9 total hours,59 lectures,Intermediate,https://www.udemy.com/course/top-python-for-data-science-course/
Calculus - Mathematics for Data Science - Machine Learning,455,Mastering Calculus - Mathematics for Deep learning / Machine learning / Data Science / Data Analysis / AI - Hands On,Manifold AI Learning ®,4.3,10 total hours,105 lectures,Intermediate,https://www.udemy.com/course/deep-learning-calculus-data-science-machine-learning-ai/
Introduction to Machine Learning for Data Science,566,"A primer on Machine Learning for Data Science. Revealed for everyday people, by the Backyard Data Scientist.",David Valentine,4.4,5.5 total hours,62 lectures,Beginner,https://www.udemy.com/course/machine-learning-for-data-science/
Artificial Intelligence A-Z™: Learn How To Build An AI,455,"Combine the power of Data Science, Machine Learning and Deep Learning to create powerful AI for Real-World applications!","Hadelin de Ponteves, Kirill Eremenko, SuperDataScience Support, Luka Anicin, Ligency Team",4.4,16.5 total hours,121 lectures,All Levels,https://www.udemy.com/course/artificial-intelligence-az/
Complete Data Analysis with Pandas : Hands-on Pandas Python,455,"Learn in demand skill Pandas, Sci-kit Learn, Numpy For Data Science & Machine Learning : Seaborn | MatplotLib | Python",Data Science & Machine Learning Academy,4.4,17 total hours,150 lectures,All Levels,https://www.udemy.com/course/data-analysis-with-pandas-python/
Complete Data Science Training with Python for Data Analysis,455,Beginners python data analytics : Data science introduction : Learn data science : Python data analysis methods tutorial,Minerva Singh,4.4,13 total hours,123 lectures,All Levels,https://www.udemy.com/course/complete-data-science-training-with-python-for-data-analysis/
Data Science & Deep Learning for Business™ 20 Case Studies,455,"Use Python to solve problems in Retail, Marketing, Product Recommendation, Customer Clustering, NLP, Forecasting & more!","Rajeev D. Ratan, Nidia Sahjara",4.4,20.5 total hours,187 lectures,All Levels,https://www.udemy.com/course/data-science-deep-learning-for-business-20-case-studies/
"Data Science, Analytics & AI for Business & the Real World™",455,Use Data Science & Statistics To Solve Business Problems & Gain Insights Into Everyday Problems With 35+ Case Studies,"Rajeev D. Ratan, Nidia Sahjara",4.4,29.5 total hours,244 lectures,Beginner,https://www.udemy.com/course/data-science-analytics-ai-for-business-the-real-world/
2021 Python for Data Science & Machine Learning from A-Z,455,"Become a professional Data Scientist and learn how to use NumPy, Pandas, Machine Learning and more!","Juan E. Galvan, Ahmed Wael",4.4,23 total hours,140 lectures,All Levels,https://www.udemy.com/course/python-for-data-science-machine-learning/
Complete Linear Algebra for Data Science & Machine Learning,455,"Linear Algebra for Data Science, Big Data, Machine Learning, Engineering & Computer Science. Master Linear Algebra",Kashif Altaf,4.4,18 total hours,211 lectures,All Levels,https://www.udemy.com/course/linear-algebra-for-beginners-matrices-and-vector-spaces/
Data Science & Machine Learning(Theory+Projects)A-Z 90 HOURS,455,"Data Science & Machine Learning with Python for Beginners-Learn Statistics, Preprocessing & Reinforcement Learning","AI Sciences, AI Sciences Team",4.4,92.5 total hours,644 lectures,All Levels,https://www.udemy.com/course/data-science-machine-learningtheoryprojectsa-z-90-hours/
"Learn Data Science -Statistics,Machine Learning & NLP-Python",455,"Learn Data Science from the basics of Statistics, Mathematics ,Machine Learning & NLP with Python",Srini E,4.4,20 total hours,112 lectures,All Levels,https://www.udemy.com/course/learn-datascience-statistics-machinelearning-nlp-python/
Data Science and Machine Learning Masterclass with R,455,"Data Science by IITan - Data Science :Data Manipulation , Data Science Data Visualization, Data Science : Data Analytics",Up Degree,4.4,15 total hours,152 lectures,All Levels,https://www.udemy.com/course/business-analytics-with-r/
SQL & Database Design A-Z™: Learn MS SQL Server + PostgreSQL,"1,920",Learn Both SQL Server & PostgreSQL By Doing. Enhance Your Data Analytics Career With Real World Data Science Exercises,"Kirill Eremenko, Ilya Eremenko, Ligency Team",4.4,12.5 total hours,104 lectures,All Levels,https://www.udemy.com/course/sqldatabases/
The Complete NumPy course For Data Science : Hands-on NumPy,455,Learn first step towards Data Science with all important concept of Numerical Python NumPy in Python For Data Science,Data Science & Machine Learning Academy,4.4,3 total hours,30 lectures,Intermediate,https://www.udemy.com/course/numpy-course/
The Complete Machine Learning and Data Science Course in R,455,Become a real time professional Data Scientist by learning the intuition and Math Behind each Machine Learning Model,Data Science Academy,4.4,17.5 total hours,146 lectures,All Levels,https://www.udemy.com/course/the-complete-machine-learning-and-data-science-course-in-r/
Master Data Science with Python in 10 Hours | 2021,455,"Learn Python, its libraries for Data Science (Pandas,Matplotlib,Seaborn) and data pre-processing for Machine Learning!","Berk Hakbilen, Tarik Sahin",4.4,10.5 total hours,62 lectures,All Levels,https://www.udemy.com/course/python-take-off-with-data-science/
From 0 to 1 : Spark for Data Science with Python,455,"Get your data to fly using Spark for analytics, machine learning and data science",Loony Corn,4.4,8.5 total hours,54 lectures,All Levels,https://www.udemy.com/course/spark-for-data-science-with-python/
2021 R 4.0 Programming for Data Science || Beginners to Pro,618,"Learn Latest R 4 with R-Studio & Jupyter. DataFrame, Vectors, Matrix, DateTime, GGplot2, Tidyverse, Plotly, etc.",Laxmi Kant,4.4,14.5 total hours,126 lectures,All Levels,https://www.udemy.com/course/r-programming-for-data-science-beginners-to-pro/
Statistics Masterclass for Data Science and Data Analytics,455,"Build a Solid Foundation of Statistics for Data Science, Learn Probability, Distributions, Hypothesis Testing, and More!",Vijay Gadhave,4.4,5 total hours,43 lectures,All Levels,https://www.udemy.com/course/statistics-for-data-science-and-analytics-masterclass/
Python for Data Science,455,Hands on to the most powerful language.,Saheb Singh Chaddha,4.4,3 total hours,21 lectures,All Levels,https://www.udemy.com/course/python4ds/
Professional Certificate in Data Science,455,"Learn All the Skills to Become a Data Scientist [ Machine Learning,Deep Learning, CNN, DCGAN, Python, Java, Algorithms]",Academy of Computing & Artificial Intelligence,4.4,26.5 total hours,169 lectures,All Levels,https://www.udemy.com/course/professional-certificate-in-data-science/
"DataScience-Stats,MachineLearning,NLP-Python-R-BigData-Spark",566,"Learn Data Science from basics of Stats,Machine Learning,NLP,DeepLearning using Python,R,BigData-Spark/Pyspark:AllLevels",Srini E,4.4,29 total hours,196 lectures,Beginner,https://www.udemy.com/course/datascience-stats-machinelearning-nlp-python-r-bigdata-spark/
Data Science with R and Python,455,"Python or R programming! Learn data science with R & Python with all in one course. You'll learn NumPy, Pandas and more",Oak Academy,4.4,13 total hours,82 lectures,All Levels,https://www.udemy.com/course/full-stack-data-science-r-and-python/
Data Science- Project Management Methodology - CRISP-DM,455,End to End High Level Overview of Data Science & AI projects,360DigiTMG Elearning,4.4,5 total hours,33 lectures,All Levels,https://www.udemy.com/course/data-science-project-management-methodology-crisp-dm/
Geospatial Data Science with Python: GeoPandas,455,Vector based geospatial analysis,Michael Miller,4.4,10 total hours,51 lectures,Intermediate,https://www.udemy.com/course/geospatial-data-science-with-python-geopandas/
Data Science - Data Mining Unsupervised Learning R & Python,"6,400",Become a Practical Data Scientist,360DigiTMG Elearning,4.4,2 total hours,10 lectures,All Levels,https://www.udemy.com/course/data-science-data-mining-unsupervised-learning-r-python/
[2021] Learn Python for Data Science A-Z | Ver 5.9,455,"Programming In Python For Data Science. Learn how to use NumPy, Pandas, Seaborn, Matplotlib, Plotly, and more!",Avinaash Guptaa,4.4,6 total hours,20 lectures,All Levels,https://www.udemy.com/course/2021-learn-python-for-data-science-a-z-ver-59/
Machine Learning A-Z™: Hands-On Python & R In Data Science,455,Learn to create Machine Learning Algorithms in Python and R from two Data Science experts. Code templates included.,"Kirill Eremenko, Hadelin de Ponteves, SuperDataScience Support, Ligency Team",4.5,44.5 total hours,322 lectures,All Levels,https://www.udemy.com/course/machinelearning/
Data Science A-Z™: Real-Life Data Science Exercises Included,468,"Learn Data Science step by step through real Analytics examples. Data Mining, Modeling, Tableau Visualization and more!","Kirill Eremenko, Ligency Team",4.5,21 total hours,217 lectures,All Levels,https://www.udemy.com/course/datascience/
Statistics for Business Analytics and Data Science A-Z™,618,"Learn The Core Stats For A Data Science Career. Master Statistical Significance, Confidence Intervals And Much More!","Kirill Eremenko, Ligency Team",4.5,6 total hours,42 lectures,All Levels,https://www.udemy.com/course/data-statistics/
Deep Learning A-Z™: Hands-On Artificial Neural Networks,455,Learn to create Deep Learning Algorithms in Python from two Machine Learning & Data Science experts. Templates included.,"Kirill Eremenko, Hadelin de Ponteves, Ligency Team",4.5,22.5 total hours,173 lectures,All Levels,https://www.udemy.com/course/deeplearning/
Power BI A-Z: Hands-On Power BI Training For Data Science!,455,Learn Microsoft Power BI for Data Science and Data Analytics. Build visualizations and BI reports with Power BI Desktop,"Kirill Eremenko, Ligency Team",4.5,4.5 total hours,44 lectures,All Levels,https://www.udemy.com/course/mspowerbi/
DP-100: A-Z Machine Learning using Azure Machine Learning,455,Microsoft Azure DP-100: Designing and Implementing a Data Science Solution Exam Covered. Learn Azure Machine Learning,"Python, Data Science & Machine Learning A-Z Team",4.5,29 total hours,243 lectures,All Levels,https://www.udemy.com/course/machine-learning-using-azureml/
Careers in Data Science A-Z™,455,"How to Become a Top Level Data Scientist - Learn What to Expect, How to be Prepared, How to Stand Out and More...","Kirill Eremenko, Hadelin de Ponteves, Ligency Team",4.5,3.5 total hours,52 lectures,Beginner,https://www.udemy.com/course/careers-in-data-science-a-ztm/
Intro to Data Science: Your Step-by-Step Guide To Starting,618,"Learn the critical elements of Data Science, from visualization to databases to Python and more, in just 6 weeks!","Kirill Eremenko, Hadelin de Ponteves, Ligency Team",4.5,5.5 total hours,42 lectures,Beginner,https://www.udemy.com/course/intro-to-data-science/
The Product Management for AI & Data Science Course 2021,455,The Complete Course for Becoming a Successful Product Manager in the Field of AI & Data Science,"365 Careers, Danielle Thé",4.5,5 total hours,67 lectures,All Levels,https://www.udemy.com/course/the-product-management-for-data-science-ai-course/
TABLEAU 2018: Hands-On Tableau Training For Data Science!,455,Learn Tableau for Data Science step-by-step. Real-Life Data Analytics Exercises & Quizzes Included. Learn by doing!,"Kirill Eremenko, Ligency Team",4.5,8 total hours,75 lectures,All Levels,https://www.udemy.com/course/tableau-2018/
RA: Data Science and Supply Chain analytics. A-Z with Python,455,"Learn Python, Supply Chain Data Science ,Linear Programming, Forecasting, Pricing and Inventory Management.",Haytham Omar,4.5,37 total hours,406 lectures,All Levels,https://www.udemy.com/course/ra-data-science-and-supply-chain-analytics-a-z-with-python/
Data Science : Master Machine Learning Without Coding,455,Learn Fundamentals Of Data Science & Machine Learning With Rapidminer (No Coding). Dataset & Solutions Included.,Ram Prasad,4.5,2.5 total hours,63 lectures,Beginner,https://www.udemy.com/course/hands-on-machine-learning-without-writing-code/
Data Science with Python Course : Hands-on Data Science 2021,455,"Numpy, Pandas, Matplotlib, Scikit-Learn, WebScraping, Data Science, Machine Learning, Pyspark, statistics, Data Science",Data Science & Machine Learning Academy,4.5,15.5 total hours,153 lectures,All Levels,https://www.udemy.com/course/data-science-with-python-and-pandas/
End to End Data Science Practicum with Knime,455,Applied Data Science Concepts and Techniques with Knime and hands on examples,Prof. Dr. ?adi Evren ?eker,4.5,9 total hours,72 lectures,All Levels,https://www.udemy.com/course/datascience-knime/
