Type,Name,Address,Grade,District,AGA Division,PS/MC/UC,Full_Add,Lat,Lon
Travel Agents,GLOBAL VILLAGE TRAVELS,"NO.215, MAIN STREET, NEGAMBO",,Gampaha,Negombo,Negombo Divisional Secretariat,"NO.215, MAIN STREET, NEGAMBO, Gampaha, Sri Lanka",79.843249,7.206416
Travel Agents,TRAVEL ARCADE CEYLON (PVT) LTD,"COLOMBO ROAD, GALAHTIIYAWA, MADAMPE",,Puttalam,Puttalam Pradeshiya Sabha,Madampe Divisional Secretariat,"COLOMBO ROAD, GALAHTIIYAWA, MADAMPE, Puttalam, Sri Lanka",79.8413814604282,7.4954162352918
Travel Agents,DESTINATION SERANDIB (PVT) LTD,"NO. 25C, RAMANADAN AVENUE, DEHIWALA",,Colombo,Dehiwala-Mount Lavinia,Dehiwala Divisional Secretariat,"NO. 25C, RAMANADAN AVENUE, DEHIWALA, Colombo, Sri Lanka",79.880242,6.838232
Travel Agents,L I C HOLIDAYS,"NO.134-A-1/1, GALLE ROAD DEHIWALA SOUTH",,Colombo,Dehiwala-Mount Lavinia,Dehiwala Divisional Secretariat,"NO.134-A-1/1, GALLE ROAD DEHIWALA SOUTH, Colombo, Sri Lanka",79.880242,6.838232
Travel Agents,JOURNEY LANKA HOLIDAYS (PVT) LTD,"NO. 1081/D/2, PANNIPITIYA ROAD, BATTARAMULLA",,Colombo,Kaduwela Pradeshiya Sabha,Colombo Divisional Secretariat,"NO. 1081/D/2, PANNIPITIYA ROAD, BATTARAMULLA, Colombo, Sri Lanka",79.913892,6.897711
Travel Agents,AIRTRAV (PVT) LTD,"NO.163, GALLE ROAD, COLOMBO 3",,Colombo,Colombo,Colombo Divisional Secretariat,"NO.163, GALLE ROAD, COLOMBO 3, Colombo, Sri Lanka",80.01667,6.86667
Travel Agents,ENJOY LANKA TOURS & TRAVELS,"NO.55/3, VINAYALANKARA MAWATHA, COLOMBO 10",,Colombo,Colombo,Colombo Divisional Secretariat,"NO.55/3, VINAYALANKARA MAWATHA, COLOMBO 10, Colombo, Sri Lanka",80.01667,6.86667
Travel Agents,DENGELO TOURING (PVT) LTD,"NO.77B, RAGAMA ROAD, KANDANA",,Gampaha,Gampaha,Gampaha Divisional Secretariat,"NO.77B, RAGAMA ROAD, KANDANA, Gampaha, Sri Lanka",79.894797,7.053406
Travel Agents,CEYLON SHIPPING LINES LTD,"NO. 450, D.R. WIJEWARDANA MAWATHA, COLOMBO 10",,Colombo,Colombo,Colombo Divisional Secretariat,"NO. 450, D.R. WIJEWARDANA MAWATHA, COLOMBO 10, Colombo, Sri Lanka",80.01667,6.86667
Travel Agents,AYUBOWAN TOURS & TRAVELS (PVT) LTD,"NO.15, COLOMBO ROAD, RANOMOTO SHOPPING COMPLEX, NEGAMBO",,Gampaha,Negombo,Negombo Divisional Secretariat,"NO.15, COLOMBO ROAD, RANOMOTO SHOPPING COMPLEX, NEGAMBO, Gampaha, Sri Lanka",80.01667,6.86667
Travel Agents,DETROVES TRAVELS (PVT) LTD,"NO.31/1, RIDGEWAY PLACE, COLOMBO 04.",,Colombo,Colombo,Colombo Divisional Secretariat,"NO.31/1, RIDGEWAY PLACE, COLOMBO 04., Colombo, Sri Lanka",80.01667,6.86667
Travel Agents,F & F TRAVELS,"NO476 D/8,FIRST FLOOR ,MARADANA SHOPPING COMPLEX,COLOMBO 10",,Colombo,Colombo,Colombo Divisional Secretariat,"NO476 D/8,FIRST FLOOR ,MARADANA SHOPPING COMPLEX,COLOMBO 10, Colombo, Sri Lanka",79.8640038818121,6.92647202862442
Travel Agents,U S TRAVELS & TOURS (PVT) LTD,"NO.218, NEW MOOR STREET, COLOMBO 12",,Colombo,Colombo,Colombo Divisional Secretariat,"NO.218, NEW MOOR STREET, COLOMBO 12, Colombo, Sri Lanka",80.01667,6.86667
Travel Agents,RANDIYA TRAVELS (PVT) LTD,"NO.154/7, PORUTHOTA ROAD, PALAGATURE, KOCHCHIKADE",,Puttalam,Puttalam Pradeshiya Sabha,Puttalam Divisional Secretariat,"NO.154/7, PORUTHOTA ROAD, PALAGATURE, KOCHCHIKADE, Puttalam, Sri Lanka",80.0,8.0
Travel Agents,AMANATH TOURS & TRAVELS,"NO. 229, 2/9, 2ND FLOOR SANTHOSH PLAZA, MAIN STREET, COLOMBO 11",,Colombo,Colombo,Colombo Divisional Secretariat,"NO. 229, 2/9, 2ND FLOOR SANTHOSH PLAZA, MAIN STREET, COLOMBO 11, Colombo, Sri Lanka",80.01667,6.86667
Travel Agents,EXOTIC GETAWAYS (PVT) LTD,"NO.106 1/1, THIMBIRIGASYAYA ROAD, COLOMBO 5",,Colombo,Colombo,Colombo Divisional Secretariat,"NO.106 1/1, THIMBIRIGASYAYA ROAD, COLOMBO 5, Colombo, Sri Lanka",79.8696080222726,6.89790460161294
Travel Agents,LOOK ASIA HOLIDAYS LANKA (PVT) LTD,"NO.4,DE ALWIS SQUARE,MOUNT LAVINIA.",,Colombo,Colombo,Colombo Divisional Secretariat,"NO.4,DE ALWIS SQUARE,MOUNT LAVINIA., Colombo, Sri Lanka",79.866418,6.842919
Travel Agents,SAFFRON ISLAND (PVT) LTD,"MO. 15, SKELTON ROAD, COLOMBO 5",,Colombo,Colombo,Colombo Divisional Secretariat,"MO. 15, SKELTON ROAD, COLOMBO 5, Colombo, Sri Lanka",80.01667,6.86667
Travel Agents,RAN TOURS,"NO.333/A, VIHARA MAWATHA, MAHAWEWA",,Puttalam,Puttalam Pradeshiya Sabha,Puttalam Divisional Secretariat,"NO.333/A, VIHARA MAWATHA, MAHAWEWA, Puttalam, Sri Lanka",79.828305859,7.453959918
Travel Agents,HOLIDAYS BY DESIGN (PVT) LTD,"NO.54,WALUKARAMA ROAD,COLOMBO 03.",,Colombo,Colombo,Colombo Divisional Secretariat,"NO.54,WALUKARAMA ROAD,COLOMBO 03., Colombo, Sri Lanka",80.01667,6.86667
Travel Agents,HAPPY LIFE TRAVELS & TOURS,"NO. 22/1, MIHINDU MAWATHA, KURUNEGALA",,Kurunegala,Kurunegala,Kurunegala Divisional Secretariat,"NO. 22/1, MIHINDU MAWATHA, KURUNEGALA, Kurunegala, Sri Lanka",80.366868,7.486218
Travel Agents,INTERSUN TRAVELS (PVT) LTD,"NO.90, YORK STREET, COLOMBO 01",,Colombo,Colombo,Colombo Divisional Secretariat,"NO.90, YORK STREET, COLOMBO 01, Colombo, Sri Lanka",80.01667,6.86667
Travel Agents,SAMBHUR VACATIONS & SAFARIS (PVT) LTD,"NO. T 46, "" NIWASIPURA"", KOTUGODA, JA ELA",,Gampaha,Ja-Ela Pradeshiya Sabha,Ja-Ela Divisional Secretariat,"NO. T 46, "" NIWASIPURA"", KOTUGODA, JA ELA, Gampaha, Sri Lanka",79.924780643,7.123494813
Travel Agents,LANKA SPORTREIZEN,"NO.29-B, S.DE S. JAYASINGHE MAWATHA ,KALUBOWILA, DEHIWELA",,Colombo,Dehiwala-Mount Lavinia,Dehiwala Divisional Secretariat,"NO.29-B, S.DE S. JAYASINGHE MAWATHA ,KALUBOWILA, DEHIWELA, Colombo, Sri Lanka",79.877308644,6.866502725
Travel Agents,AMERASIAN TRAVELS (PVT) LTD,"NO.61/9, DHARMAPALA, MAWATHA, COLOMBO 3",,Colombo,Colombo,Colombo Divisional Secretariat,"NO.61/9, DHARMAPALA, MAWATHA, COLOMBO 3, Colombo, Sri Lanka",80.01667,6.86667
Travel Agents,WORLD AVENUES (PVT) LTD,"NO.30, HYDE PARK CORNER, COLOMBO 2",,Colombo,Colombo,Colombo Divisional Secretariat,"NO.30, HYDE PARK CORNER, COLOMBO 2, Colombo, Sri Lanka",80.01667,6.86667
Travel Agents,QWEST DESTINATIONS (PVT) LTD,"NO.119A, CASTLE STREET, COLOMBO 08",,Colombo,Colombo,Colombo Divisional Secretariat,"NO.119A, CASTLE STREET, COLOMBO 08, Colombo, Sri Lanka",80.01667,6.86667
Travel Agents,KAWAIKI TOURS & TRAVELS (PVT) LTD,"NO.31, JESWEL PLACE, MIRIHANA, NUGEGODA",,Colombo,Colombo,Colombo Divisional Secretariat,"NO.31, JESWEL PLACE, MIRIHANA, NUGEGODA, Colombo, Sri Lanka",79.893438,6.877014
Travel Agents,HAFSA TRAVELS & TOURS (PVT) LTD,"NO. 13 A1, KURUNEGALA ROAD , PUTTALAM",,Puttalam,Chilaw Pradeshiya Sabha,Chilaw Divisional Secretariat,"NO. 13 A1, KURUNEGALA ROAD , PUTTALAM, Puttalam, Sri Lanka",79.83367,8.031354
Travel Agents,ALOYS TRAVEL SERVICE (PVT) LTD,"NO. 66, BANGALAWATTA ROAD, MABOLA, WATTALA",,Gampaha,Wattala Pradeshiya Sabha,Wattala Divisional Secretariat,"NO. 66, BANGALAWATTA ROAD, MABOLA, WATTALA, Gampaha, Sri Lanka",79.883006,6.9889
Travel Agents,NUSRATH TOURS & TRAVELS,"NO.395/ 1/1, PERADENIYA ROAD, KANDY",,Kandy,Kandy,Kandy Divisional Secretariat,"NO.395/ 1/1, PERADENIYA ROAD, KANDY, Kandy, Sri Lanka",80.625828,7.295044
Travel Agents,TOUR SOLUTIONS LANKA (PVT) LTD,"NO.128, VAUXHALL STREET, COLOMBO 2",,Colombo,Colombo,Colombo Divisional Secretariat,"NO.128, VAUXHALL STREET, COLOMBO 2, Colombo, Sri Lanka",80.01667,6.86667
Travel Agents,UMMUL QURA TRAVELS & TOURS (PVT) LTD,"NO.307A, MAKKAMADY ROAD, MARUTHAMUNAI",,Ampara,Ampara,Samanthurai Divisional Secretariat,"NO.307A, MAKKAMADY ROAD, MARUTHAMUNAI, Ampara, Sri Lanka",81.8129664380103,7.43435840009084
Travel Agents,TRAVEL WORLD (PVT) LTD,"NO.12, GALLE FACE COURT 2, COLOMBO 3",,Colombo,Colombo,Colombo Divisional Secretariat,"NO.12, GALLE FACE COURT 2, COLOMBO 3, Colombo, Sri Lanka",80.01667,6.86667
Travel Agents,HEART ATTACHED (PVT) LTD,"UNIT 2A, 30A, ALWIS PLACE, COLOMBO 3",,Colombo,Colombo,Colombo Divisional Secretariat,"UNIT 2A, 30A, ALWIS PLACE, COLOMBO 3, Colombo, Sri Lanka",80.01667,6.86667
Travel Agents,AMERICAN LLOYD TRAVELS LTD,"NO. 8-1/3, YORK ARCADE BUILDING, LEYDEN BASTIAN ROAD, COLOMBO 01",,Colombo,Colombo,Colombo Divisional Secretariat,"NO. 8-1/3, YORK ARCADE BUILDING, LEYDEN BASTIAN ROAD, COLOMBO 01, Colombo, Sri Lanka",80.01667,6.86667
Travel Agents,SETMIL TRAVELS & TOURS (PVT) LTD,"SETMIL MERITIME CENTRE, NO.256, SRIMATH RAMANATHAN MAWATHA, COLOMBO 15",,Colombo,Colombo,Colombo Divisional Secretariat,"SETMIL MERITIME CENTRE, NO.256, SRIMATH RAMANATHAN MAWATHA, COLOMBO 15, Colombo, Sri Lanka",80.01667,6.86667
Travel Agents,SUDANS INTERNATIONAL TRAVELS AND TOURS (PVT) LTD,"NO.24B, PARANAWATTA, HENDALA, WATTALA",,Gampaha,Wattala Pradeshiya Sabha,Wattala Divisional Secretariat,"NO.24B, PARANAWATTA, HENDALA, WATTALA, Gampaha, Sri Lanka",79.883006,6.9889
Travel Agents,GULLIVERS TRAVELS (PRIVATE) LIMITED,"NO.48, LEVEL 06, PARKWAY, PARK STREET, COLOMBO 2",,Colombo,Colombo,Colombo Divisional Secretariat,"NO.48, LEVEL 06, PARKWAY, PARK STREET, COLOMBO 2, Colombo, Sri Lanka",80.01667,6.86667
Travel Agents,SELCO GLOBAL HOLIDAYS,"NO.31, 1ST CHAPPEL LANE, COLOMBO 6",,Colombo,Colombo,Colombo Divisional Secretariat,"NO.31, 1ST CHAPPEL LANE, COLOMBO 6, Colombo, Sri Lanka",80.01667,6.86667
Travel Agents,HERITAGE HOLIDAY LANKA (PVT) LTD,"NO.63/1B, KANDY ROAD, KIRIBATHGODA",,Gampaha,Kelaniya Pradeshiya Sabha,Kelaniya Divisional Secretariat,"NO.63/1B, KANDY ROAD, KIRIBATHGODA, Gampaha, Sri Lanka",79.927390767,6.978059805
Travel Agents,V V K TOURS & TRAVELS (PVT) LTD,"NO.66/1, KANDY ROAD, DALUGAMA, KELANIYA",,Colombo,Kolonna Pradeshiya Sabha,Kolonnawa Divisional Secretariat,"NO.66/1, KANDY ROAD, DALUGAMA, KELANIYA, Colombo, Sri Lanka",80.5675690993667,7.23909238125421
Travel Agents,LECS TRAVELS (PVT) LTD,"2ND FLOOR, AUTO MOBILE ASSOCIATION BUILDING, NO.40, SIR MOHOMED MAKAN MAKER MW., COLOMBO 3",,Colombo,Colombo,Colombo Divisional Secretariat,"2ND FLOOR, AUTO MOBILE ASSOCIATION BUILDING, NO.40, SIR MOHOMED MAKAN MAKER MW., COLOMBO 3, Colombo, Sri Lanka",80.01667,6.86667
Travel Agents,THE BOTTOM LINE HOLIDAYS (PVT) LIMITED,"SUNCITY, NO.18-2/2, ST.ANTHONYS MAWATHA, COLOMBO 3.",,Colombo,Colombo,Colombo Divisional Secretariat,"SUNCITY, NO.18-2/2, ST.ANTHONYS MAWATHA, COLOMBO 3., Colombo, Sri Lanka",80.01667,6.86667
Travel Agents,AIRPORT TRAVELS (PVT) LTD,"NO.21, DEAL PLACE, COLOMBO 03",,Colombo,Colombo,Colombo Divisional Secretariat,"NO.21, DEAL PLACE, COLOMBO 03, Colombo, Sri Lanka",80.01667,6.86667
Travel Agents,A J TRAVEL,"110, NEW GALLE ROAD, MORATUWA",,Colombo,Moratuwa,Moratuwa Divisional Secretariat,"110, NEW GALLE ROAD, MORATUWA, Colombo, Sri Lanka",79.888881,6.790527
Travel Agents,AL-AQSA GLOBAL (PVT)LTD,"NO. 86 A 1/1, WATARAPPALA ROAD, MOUNT LAVINIA",,Colombo,Colombo,Colombo Divisional Secretariat,"NO. 86 A 1/1, WATARAPPALA ROAD, MOUNT LAVINIA, Colombo, Sri Lanka",79.866418,6.842919
Travel Agents,ASIAN WINGS (PVT) LTD,"NO.64, W.A.D. RAMANAYAKE MAWATHA, COLOMBO 2",,Colombo,Colombo,Colombo Divisional Secretariat,"NO.64, W.A.D. RAMANAYAKE MAWATHA, COLOMBO 2, Colombo, Sri Lanka",80.01667,6.86667
Travel Agents,WAYFARERS (PVT) LTD,"NO.6, BOYD PLACE, COLOMBO 3",,Colombo,Colombo,Colombo Divisional Secretariat,"NO.6, BOYD PLACE, COLOMBO 3, Colombo, Sri Lanka",80.01667,6.86667
Travel Agents,EURO ASIA TRAVELS (PVT) LTD,"NO.51/2, ANANDA COOMARASWAMY MAWATHA, COLOMBO 07",,Colombo,Colombo,Colombo Divisional Secretariat,"NO.51/2, ANANDA COOMARASWAMY MAWATHA, COLOMBO 07, Colombo, Sri Lanka",80.01667,6.86667
Travel Agents,AKQUASUN LANKA (PVT) LIMITED,"L12, EAST TOWER, WORLD TRADE CENTER, COLOMBO 01",,Colombo,Colombo,Colombo Divisional Secretariat,"L12, EAST TOWER, WORLD TRADE CENTER, COLOMBO 01, Colombo, Sri Lanka",80.01667,6.86667
Travel Agents,HELANKA VACATIONS (PTE) LTD,"LEVEL 06, ACCESS TOWERS, NO.278, UNION PLACE, COLOMBO 02",,Colombo,Colombo,Colombo Divisional Secretariat,"LEVEL 06, ACCESS TOWERS, NO.278, UNION PLACE, COLOMBO 02, Colombo, Sri Lanka",80.01667,6.86667
Travel Agents,MULTHAZAM ENTERPRISES & TRAVELS,"NO.262K, MAIN STREET, SAINTHAMARUTHU- 07",,Ampara,Kalmunai,Kalmunai Divisional Secretariat,"NO.262K, MAIN STREET, SAINTHAMARUTHU- 07, Ampara, Sri Lanka",81.8341709766537,7.39446457472978
Travel Agents,AATHIKA HAJ TRAVELS,"NO.18/1, MATALE ROAD, KATUGASTOTA, KANDY",,Kandy,Kandy,Kandy Divisional Secretariat,"NO.18/1, MATALE ROAD, KATUGASTOTA, KANDY, Kandy, Sri Lanka",80.625828,7.295044
Travel Agents,CEYLINE TRAVELS (PVT) LTD,"NO.01, ALFRED HOUSE AVENUE, COLOMBO 03",,Colombo,Colombo,Colombo Divisional Secretariat,"NO.01, ALFRED HOUSE AVENUE, COLOMBO 03, Colombo, Sri Lanka",80.01667,6.86667
Travel Agents,BENCHMARK HOLIDAYS,"NO. 290, D. K. WIJEWARDANA MW, COLOMBO 10",,Colombo,Colombo,Colombo Divisional Secretariat,"NO. 290, D. K. WIJEWARDANA MW, COLOMBO 10, Colombo, Sri Lanka",80.01667,6.86667
Travel Agents,A BAUR & CO. (TRAVEL) LTD,"NO. 05, UPPER CHATHAM STREET, COLOMBO 01",,Colombo,Colombo,Colombo Divisional Secretariat,"NO. 05, UPPER CHATHAM STREET, COLOMBO 01, Colombo, Sri Lanka",80.01667,6.86667
Travel Agents,AIR MARK TRAVELS & TOURS (PVT) LTD,"NO.94, CHATHAM STREET, COLOMBO 01",,Colombo,Colombo,Colombo Divisional Secretariat,"NO.94, CHATHAM STREET, COLOMBO 01, Colombo, Sri Lanka",80.01667,6.86667
Travel Agents,LUXE ASIA (PVT) LTD,"NO.272,VAUXHALL STREET,COLOMBO 02.",,Colombo,Colombo,Colombo Divisional Secretariat,"NO.272,VAUXHALL STREET,COLOMBO 02., Colombo, Sri Lanka",80.01667,6.86667
Travel Agents,I TRAVEL (PVT) LTD,"NO.66/12, GREEN PATH, COLOMBO 03",,Colombo,Colombo,Colombo Divisional Secretariat,"NO.66/12, GREEN PATH, COLOMBO 03, Colombo, Sri Lanka",80.01667,6.86667
Travel Agents,MALDIVIANA HOLIDAYS (PVT) LTD,"NO. 64A/1, MODARAWELLA, MARAWILA",,Colombo,Colombo,Colombo Divisional Secretariat,"NO. 64A/1, MODARAWELLA, MARAWILA, Colombo, Sri Lanka",80.01667,6.86667
Travel Agents,L.T.O. HOLIDAYS (PVT) LTD,"01-02, WEST GROUND FLOOR, WORLD TRADE CENTER, COLOMBO 01",,Colombo,Colombo,Colombo Divisional Secretariat,"01-02, WEST GROUND FLOOR, WORLD TRADE CENTER, COLOMBO 01, Colombo, Sri Lanka",80.01667,6.86667
Travel Agents,AR TRAVELS & TOURS,"NO.310/2A1/1, GEORGE R DE SILVA MAWATHA, COLOMBO 13",,Colombo,Colombo,Colombo Divisional Secretariat,"NO.310/2A1/1, GEORGE R DE SILVA MAWATHA, COLOMBO 13, Colombo, Sri Lanka",80.01667,6.86667
Travel Agents,COUNTRY FEELING HOLIDAYS (PVT) LTD,"NO.58A, CAHRLES PLACE, RAWATHAWATTE, MORATUWA",,Colombo,Moratuwa,Moratuwa Divisional Secretariat,"NO.58A, CAHRLES PLACE, RAWATHAWATTE, MORATUWA, Colombo, Sri Lanka",79.888881,6.790527
Travel Agents,N P S TRAVELS (PVT) LTD,"2ND FLOOR, LANKAMATHA BUILDING, CHILAW ROAD, WENNAPPUWA",,Gampaha,Wennappuwa Pradeshiya Sabha,Wennappuwa Divisional Secretariat,"2ND FLOOR, LANKAMATHA BUILDING, CHILAW ROAD, WENNAPPUWA, Gampaha, Sri Lanka",80.0,7.13333
Travel Agents,M P S HAJ TRAVELS,"NO.14, MAIN STREET, MADURANKULI",,Puttalam,Puttalam Pradeshiya Sabha,Puttalam Divisional Secretariat,"NO.14, MAIN STREET, MADURANKULI, Puttalam, Sri Lanka",80.0,8.0
Travel Agents,ROYAL AL FATHIMA TRAVELS,"NO.271, KUDDIKARACH, KINNIYA - 04, TRINCOMALEE",,Trincomalee,Kinniya,Kinniya Divisional Secretariat,"NO.271, KUDDIKARACH, KINNIYA - 04, TRINCOMALEE, Trincomalee, Sri Lanka",81.216793,8.578088
Travel Agents,LIFE LEISURE HOLIDAYS (PVT) LTD,"NO.31, LAYARDS ROAD, COLOMBO 05",,Colombo,Colombo,Colombo Divisional Secretariat,"NO.31, LAYARDS ROAD, COLOMBO 05, Colombo, Sri Lanka",80.01667,6.86667
Travel Agents,TGL LANKA TRAVELS (PTE) LTD,"NO.43/03, THIRD FLOOR, BODHIRAJA MAWATHA, KURUNEGALA",,Kurunegala,Kurunegala,Kurunegala Divisional Secretariat,"NO.43/03, THIRD FLOOR, BODHIRAJA MAWATHA, KURUNEGALA, Kurunegala, Sri Lanka",80.366868,7.486218
Travel Agents,DREAM VACATIONS (PVT) LTD,"NO.288/12T,ROYAL GARDENS,RAJAGIRIYA.",,Colombo,Colombo,Colombo Divisional Secretariat,"NO.288/12T,ROYAL GARDENS,RAJAGIRIYA., Colombo, Sri Lanka",79.896217547,6.909504175
Travel Agents,AJWA TRAVELS,"NO. 20/2A/1, GOTHAMI MAWATHA, KITTHAMPAHUWA, WELLAMPITIYA",,Colombo,Kolonnawa,Kolonnawa Divisional Secretariat,"NO. 20/2A/1, GOTHAMI MAWATHA, KITTHAMPAHUWA, WELLAMPITIYA, Colombo, Sri Lanka",79.896185528,6.93722362
Travel Agents,UNIGLOBE LEISURE WORLD TRAVEL (PVT) LTD,"NO. 61, ANANDA COOMARASWAMY MAWATHA, COLOMBO 03",,Colombo,Colombo,Colombo Divisional Secretariat,"NO. 61, ANANDA COOMARASWAMY MAWATHA, COLOMBO 03, Colombo, Sri Lanka",80.01667,6.86667
Travel Agents,SERENDIVUS INTERNATIONAL (PRIVATE) LIMITED,"NO.243, 3/1, HAVLOCK ROAD, COLOMBO 06",,Colombo,Colombo,Thimbirigasyaya Divisional Secretariat,"NO.243, 3/1, HAVLOCK ROAD, COLOMBO 06, Colombo, Sri Lanka",80.01667,6.86667
Travel Agents,AMADIV HOLIDAYS LANKA (PVT) LTD,"NO. 150, 2ND FLOOR, GREENS ROAD, NEGOMBO",,Gampaha,Negombo,Negombo Divisional Secretariat,"NO. 150, 2ND FLOOR, GREENS ROAD, NEGOMBO, Gampaha, Sri Lanka",79.843249,7.206416
Travel Agents,WALKSONS TOURIST (PRIVATE) LIMITED,"BLOCK 03, NEW RENIL ESTATE, HINDAGOLLA, KURUNEGALA",,Kurunegala,Mawathagama Pradeshiya Sabha,Mawathagama Divisional Secretariat,"BLOCK 03, NEW RENIL ESTATE, HINDAGOLLA, KURUNEGALA, Kurunegala, Sri Lanka",80.366868,7.486218
Travel Agents,JNW LANKA TOURS,"JNW BUILDING, NO. 67, MALIGAKANDA ROAD, COLOMBO 10",,Colombo,Colombo,Colombo Divisional Secretariat,"JNW BUILDING, NO. 67, MALIGAKANDA ROAD, COLOMBO 10, Colombo, Sri Lanka",79.8676304798573,6.92784153555009
Travel Agents,INTERNATIONAL TRAVEL BUREAU (PVT) LTD,"NO.83, 1ST FLOOR, MALIGAKANDA ROAD, MARADANA, COLOMBO 10",,Colombo,Colombo,Colombo Divisional Secretariat,"NO.83, 1ST FLOOR, MALIGAKANDA ROAD, MARADANA, COLOMBO 10, Colombo, Sri Lanka",79.8676304798573,6.92784153555009
Travel Agents,LETS TRAVEL (PRIVATE ) LIMITED,"CP 04, HOTEL GALADARI, LOTUS ROAD, COLOMBO 01",,Colombo,Colombo,Colombo Divisional Secretariat,"CP 04, HOTEL GALADARI, LOTUS ROAD, COLOMBO 01, Colombo, Sri Lanka",80.01667,6.86667
Travel Agents,EXOTIC HOLIDAYS INTERNATIONAL (PVT) LTD,"NO.7 BARNES AVENUE, MOUNT LAVINIA",,Colombo,Dehiwala-Mount Lavinia,Dehiwala Divisional Secretariat,"NO.7 BARNES AVENUE, MOUNT LAVINIA, Colombo, Sri Lanka",80.01667,6.86667
Travel Agents,AIRWING TOURS (PVT) LTD,"NO.68, COLOMBO ROAD, NEGOMBO",,Gampaha,Negombo,Negombo Divisional Secretariat,"NO.68, COLOMBO ROAD, NEGOMBO, Gampaha, Sri Lanka",79.843249,7.206416
Travel Agents,EXOTIC GLOBAL HOLIDAYS (PRIVATE) LIMITED,"NO.40, VISAKA ROAD, COLOMBO 04",,Colombo,Colombo,Colombo Divisional Secretariat,"NO.40, VISAKA ROAD, COLOMBO 04, Colombo, Sri Lanka",80.01667,6.86667
Travel Agents,KHAIRAZ INTERNATIONAL TRAVELS & TOURS,"NO. 298, GEORGE R DE SILVA MAWATHA, COLOMBO 13",,Colombo,Colombo,Colombo Divisional Secretariat,"NO. 298, GEORGE R DE SILVA MAWATHA, COLOMBO 13, Colombo, Sri Lanka",80.01667,6.86667
Travel Agents,WHITTALL BOUSTEAD (TRAVEL) LTD,"NO.117 SIR CHITHAMPALAM A GARDINER MW, COLOMBO 02",,Colombo,Colombo,Colombo Divisional Secretariat,"NO.117 SIR CHITHAMPALAM A GARDINER MW, COLOMBO 02, Colombo, Sri Lanka",80.01667,6.86667
Travel Agents,PRIME VACATIONS (PVT) LTD,"NO.432 1/1, PANNIPITIYA ROAD, PELAWATTA, BATTARAMULLA",,Colombo,Colombo,Colombo Divisional Secretariat,"NO.432 1/1, PANNIPITIYA ROAD, PELAWATTA, BATTARAMULLA, Colombo, Sri Lanka",79.913892,6.897711
Travel Agents,LION ROYAL (PVT) LTD,"NO.45, BRAYBROOK STREET, COLOMBO 02",,Colombo,Colombo,Colombo Divisional Secretariat,"NO.45, BRAYBROOK STREET, COLOMBO 02, Colombo, Sri Lanka",80.01667,6.86667
Travel Agents,LANKA VISION HOLIDAYS (PVT) LTD,"L-2, REALITY PLAZA, COLOMBO ROAD, JA-ELA",,Gampaha,Ja-Ela Pradeshiya Sabha,Ja-Ela Divisional Secretariat,"L-2, REALITY PLAZA, COLOMBO ROAD, JA-ELA, Gampaha, Sri Lanka",80.01667,6.86667
Travel Agents,WAYAMBA LANKA TRAVELS & TOURS CO-OPERATIVE SOCIETY LIMITED,"RUBANK HOUSE, N0. 107, DAMBULL ROAD, KURUNEGALA",,Kurunegala,Kurunegala,Kurunegala Divisional Secretariat,"RUBANK HOUSE, N0. 107, DAMBULL ROAD, KURUNEGALA, Kurunegala, Sri Lanka",80.366868,7.486218
Travel Agents,HAJARA TRAVELS (PVT) LTD,"NO.1D-1/1,01ST FLOOR,CHARLEMONT ROAD,COLOMBO 06.",,Colombo,Colombo,Colombo Divisional Secretariat,"NO.1D-1/1,01ST FLOOR,CHARLEMONT ROAD,COLOMBO 06., Colombo, Sri Lanka",80.01667,6.86667
Travel Agents,I-TECH TOURS & TRAVELS (PVT) LTD,"NO.56/1/1, FIRST FLOOR, KANDY ROAD, KIRIBATHGODA",,Gampaha,Kelaniya Pradeshiya Sabha,Kelaniya Divisional Secretariat,"NO.56/1/1, FIRST FLOOR, KANDY ROAD, KIRIBATHGODA, Gampaha, Sri Lanka",79.927390767,6.978059805
Travel Agents,WORLD LANKA TOURS (PVT) LTD,"NO.60, COTTA ROAD, BORELLA, COLOMBO 08",,Colombo,Colombo,Colombo Divisional Secretariat,"NO.60, COTTA ROAD, BORELLA, COLOMBO 08, Colombo, Sri Lanka",79.8775897733867,6.9148169552909
Travel Agents,SEE LANKA TRAVELS (PVT) LTD,"4TH FLOOR, NO.77, DHARMAPALA MAWATHA, COLOMBO 03",,Colombo,Colombo,Colombo Divisional Secretariat,"4TH FLOOR, NO.77, DHARMAPALA MAWATHA, COLOMBO 03, Colombo, Sri Lanka",80.01667,6.86667
Travel Agents,AERO LANKA TOURS AND TRAVELS (PVT) LTD,"NO.24, COL. T.G. JAYAWARDENA MAWATHA, COLOMBO 03",,Colombo,Colombo,Colombo Divisional Secretariat,"NO.24, COL. T.G. JAYAWARDENA MAWATHA, COLOMBO 03, Colombo, Sri Lanka",80.01667,6.86667
Travel Agents,HOLIDAY PARK (PVT) LTD,"NO. 26, 2/1, SECOND FLOOR, HILL STREET , DEHIWALA",,Colombo,Dehiwala-Mount Lavinia,Dehiwala Divisional Secretariat,"NO. 26, 2/1, SECOND FLOOR, HILL STREET , DEHIWALA, Colombo, Sri Lanka",79.880242,6.838232
Travel Agents,SHAN TOURS INTERNATIONAL (PVT) LTD,"NO.250, GALLE ROAD, HIKKADUWA",,Galle,Hikkaduwa,Hikkaduwa Divisional Secretariat,"NO.250, GALLE ROAD, HIKKADUWA, Galle, Sri Lanka",80.223192,6.043279
Travel Agents,MINA TRAVELS & TOURS (PVT) LTD,"G / L/ G 3, DIAS PLACE, GUNASINGHAPURA, COLOMBO 12",,Colombo,Colombo,Colombo Divisional Secretariat,"G / L/ G 3, DIAS PLACE, GUNASINGHAPURA, COLOMBO 12, Colombo, Sri Lanka",80.01667,6.86667
Travel Agents,AL- ZAAMIL LANKA TOURS & TRAVELS (PVT) LTD,"NO. 38 1/2 & 38 1/2A, SECOND FLOOR, SYMONDS ROAD, MARADANA COLOMBO",,Colombo,Colombo,Colombo Divisional Secretariat,"NO. 38 1/2 & 38 1/2A, SECOND FLOOR, SYMONDS ROAD, MARADANA COLOMBO, Colombo, Sri Lanka",79.8640038818121,6.92647202862442
Travel Agents,ELEVEN TOURS DMC (PVT) LTD,"M-15, GALADARAI HOTEL, NO.64, LOTUS ROAD, ECHELON SQUARE, COLOMBO 01",,Colombo,Colombo,Colombo Divisional Secretariat,"M-15, GALADARAI HOTEL, NO.64, LOTUS ROAD, ECHELON SQUARE, COLOMBO 01, Colombo, Sri Lanka",80.01667,6.86667
Travel Agents,ECO TEAM (PVT) LTD,"NO.20/63, FAIRFIELD GARDENS, COLOMBO 08",,Colombo,Colombo,Colombo Divisional Secretariat,"NO.20/63, FAIRFIELD GARDENS, COLOMBO 08, Colombo, Sri Lanka",80.01667,6.86667
Travel Agents,CEYLON SUNNY HOLIDAYS (PVT) LTD,"NO.487, FOUR WAY JUNCTION, NAGODA, KALUTARA SOUTH",,Kalutara,Kalutara Pradeshiya Sabha,Nagoda Divisional Secretariat,"NO.487, FOUR WAY JUNCTION, NAGODA, KALUTARA SOUTH, Kalutara, Sri Lanka",79.989157934,6.568683873
Travel Agents,INNO VENTURES (PVT) LTD,"NO.11/4, ARCADIA GARDENS, ROSMEAD PLACE, COLOMBO 07",,Colombo,Colombo,Colombo Divisional Secretariat,"NO.11/4, ARCADIA GARDENS, ROSMEAD PLACE, COLOMBO 07, Colombo, Sri Lanka",80.01667,6.86667
Travel Agents,AL RAHAMATH TRAVELS & TOURS,"NO.194/A4, BANDARANAYAKE MAWATHA, COLOMBO 12",,Colombo,Colombo,Colombo Divisional Secretariat,"NO.194/A4, BANDARANAYAKE MAWATHA, COLOMBO 12, Colombo, Sri Lanka",80.01667,6.86667
Travel Agents,SEASONS TRAVELS,"NO.07, NORTH LAKE ROAD, KURUNEGALA",,Kurunegala,Kurunegala,Kurunegala Divisional Secretariat,"NO.07, NORTH LAKE ROAD, KURUNEGALA, Kurunegala, Sri Lanka",80.366868,7.486218
Travel Agents,HORNBILL HOLIDAYS CEYLON (PVT) LTD,"82, TEMPLERS ROAD, MOUNT LAVINIA",,Colombo,Dehiwala-Mount Lavinia,Dehiwala Divisional Secretariat,"82, TEMPLERS ROAD, MOUNT LAVINIA, Colombo, Sri Lanka",79.866418,6.842919
Travel Agents,LANKA HOLIDAYS NET (PVT) LTD,"NO. 39,2/2, GALLE FACE TERRACE, COLOMBO 03",,Colombo,Colombo,Colombo Divisional Secretariat,"NO. 39,2/2, GALLE FACE TERRACE, COLOMBO 03, Colombo, Sri Lanka",80.01667,6.86667
Travel Agents,ROSEN TOURS (PVT) LTD,"15A, DE FONSEKA ROAD, COLOMBO 05",,Colombo,Colombo,Colombo Divisional Secretariat,"15A, DE FONSEKA ROAD, COLOMBO 05, Colombo, Sri Lanka",80.01667,6.86667
Travel Agents,HERITAGE EXPEDICIONES (PVT) LTD,"NO-106/3, THIMBIRIGASYAYA RD, COLOMBO 05.",,Colombo,Colombo,Colombo Divisional Secretariat,"NO-106/3, THIMBIRIGASYAYA RD, COLOMBO 05., Colombo, Sri Lanka",79.8696080222726,6.89790460161294
Travel Agents,H.M.H. HAJ TRAVELS,"MAL / 8TH STREET, BLOCK ""J"" , WEST SAMANTHURAI",,Ampara,Ampara,Samanthurai Divisional Secretariat,"MAL / 8TH STREET, BLOCK ""J"" , WEST SAMANTHURAI, Ampara, Sri Lanka",81.75,7.08333
Travel Agents,BARAKATH TRAVELS & TOURS (PVT) LTD,"66-1/ 15, MALWATTA ROAD, COLOMBO 11",,Colombo,Colombo,Colombo Divisional Secretariat,"66-1/ 15, MALWATTA ROAD, COLOMBO 11, Colombo, Sri Lanka",80.01667,6.86667
Travel Agents,ADHVAN TOURS (PVT) LTD,"NO.129, DUTUGAMUNU STREET, DEHIWALA",,Colombo,Dehiwala-Mount Lavinia,Dehiwala Divisional Secretariat,"NO.129, DUTUGAMUNU STREET, DEHIWALA, Colombo, Sri Lanka",79.880242,6.838232
Travel Agents,PAN LANKA TRAVELS & TOURS (PVT) LTD,"NO. 06, PALMYRAH AVENUE, COLOMBO 03",,Colombo,Colombo,Colombo Divisional Secretariat,"NO. 06, PALMYRAH AVENUE, COLOMBO 03, Colombo, Sri Lanka",80.01667,6.86667
Travel Agents,ALDRICH TRAVELS & TOURS,"NO. 07, GALLE FACE COURT - 02, GALLE FACE, GALLE ROAD, COLOMBO 03",,Colombo,Colombo,Colombo Divisional Secretariat,"NO. 07, GALLE FACE COURT - 02, GALLE FACE, GALLE ROAD, COLOMBO 03, Colombo, Sri Lanka",80.214954922,6.03281393
Travel Agents,GO VACATION LANKA CO. (PVT) LTD,"NO. 46/26, JETWING HOUSE, NAVAM MAWATHA, COLOMBO 02",,Colombo,Colombo,Colombo Divisional Secretariat,"NO. 46/26, JETWING HOUSE, NAVAM MAWATHA, COLOMBO 02, Colombo, Sri Lanka",80.01667,6.86667
Travel Agents,B.O.C. TRAVELS (PVT) LTD,"1ST FLORR, BANK OF CEYLON SUPER GRADE BRANCH BUILDING, BASELINE ROAD, COLOMBO 08",,Colombo,Colombo,Colombo Divisional Secretariat,"1ST FLORR, BANK OF CEYLON SUPER GRADE BRANCH BUILDING, BASELINE ROAD, COLOMBO 08, Colombo, Sri Lanka",80.01667,6.86667
Travel Agents,BG AIR SERVICES (PVT) LTD,"NO.02, ELIBANK ROAD, COLOMBO 05",,Colombo,Colombo,Colombo Divisional Secretariat,"NO.02, ELIBANK ROAD, COLOMBO 05, Colombo, Sri Lanka",80.01667,6.86667
