,Movie,Year,Genre,RunTime,Rating,Director,Actor,Description,IMDB_Score,Metascore,Votes,USA_Gross,Category
481,Batman Beyond: The Movie,(1999 TV Movie),"Animation,Sci-Fi,Action",132 min,TV-Y7,"CurtGeda,ButchLukic,DanRiba,YukioSuzuki","WillFriedle,KevinConroy,TeriGarr,MichaelGross","Decades after the retirement of Bruce Wayne as Batman, a boy dons the identity to avenge his own father's murder.",7.8,,"5,577",,DC
482,Zatanna,,"Action,Adventure,Fantasy",,,,,"Like her father Zatara, Zatanna has many magical powers, and in that first issue, she's on a journey to find him.",,,,,DC
483,Freedom Fighters: The Ray,(2018 Video),"Animation,Action,Fantasy",73 min,Not Rated,EthanSpaulding,"RussellTovey,JasonMitchell,DilshadVadsaria,MelissaBenoist","Earth X is one of many realities in the multiverse, with one glaring difference from our Earth; the Nazis won World War II! Led by The Ray, it is here that a group of heroes known as the ...                See full summary »",6.2,,480,,DC
484,Lego Batman: The Movie - DC Super Heroes Unite,(2013 Video),"Animation,Action,Adventure",71 min,Not Rated,JonBurton,"ClancyBrown,TroyBaker,ChristopherCoreySmith,CharlieSchlatter","When the Joker and Lex Luthor form an alliance, Batman must team up with the Justice League in order to stop them.",6.5,,"4,851",,DC
485,Mortal Kombat vs. DC Universe,(2008 Video Game),"Action,Adventure,Fantasy",,T,DominicCianciolo,"ChaseAshbaker,JohannaAñonuevo,RonaldM.Banks,DanaLynBaron","The world of Justice League and the Netherealm collide following the merge between Darkseid and Shao Kahn, ultimately forming Dark Kahn. Heroes are haunted by a mysterious force called Rage, forgetting who the true enemy is.",6.8,,"1,380",,DC
486,The Zeta Project,(2001–2003),"Animation,Action,Sci-Fi",30 min,TV-Y7,,"DiedrichBader,JulieNathanson,DanielNicodème,KurtwoodSmith","A robot rebels against its creators, refusing to kill, and goes on the run.",7.1,,747,,DC
487,JLA Adventures: Trapped in Time,(2014 Video),"Animation,Action,Sci-Fi",52 min,TV-Y7,GiancarloVolpe,"DiedrichBader,LauraBailey,DanteBasco,CoreyBurton","Lex Luthor is frozen during a battle with the Justice League. He thaws out in the 31st century, discovers Time Trapper and prevents Superman's arrival to Earth as a baby. Future teen heroes Karate Kid and Dawnstar must stop him.",5.8,,"3,721",,DC
488,Gotham Girls,(2000– ),"Animation,Comedy,Crime",,TV-PG,,"ArleenSorkin,DianePershing,TaraStrong,AdrienneBarbeau",The adventures of the female superheroes and supervillains of Gotham City.,7.4,,419,,DC
489,Lego Batman: The Videogame,(2008 Video Game),"Action,Adventure,Fantasy",,E10+,JonBurton,"OgieBanks,SteveBlum,ChrisEdgerly,KeithFerguson","The notorious criminals including the Joker, the Penguin, Catwoman, and Scarecrow have broken out of Arkham Asylum and are set to wreak havoc in Gotham City.",7.9,,"2,815",,DC
490,Under the Hood,(2009 Video),"Short,Action,Adventure",38 min,PG,EricMatthies,"TedFriend,StephenMcHattie,CarlaGugino,JeffreyDeanMorgan","A television interview with Hollis Mason, The first Nite-Owl, about his life and the superhero community.",7.2,,"1,777",,DC
491,Lobo,(2000),"Animation,Short,Action",2 min,TV-MA,,"KevinMichaelRichardson,TomKenny,GreyGriffin,DeeBradleyBaker","The many adventures of the Main Man Lobo, a galactic bounty hunter.",6.8,,95,,DC
492,Superman,(1988),"Animation,Short,Action",30 min,,,"BeauWeaver,GinnyMcSwain,MarkL.Taylor,TressMacNeille",The Man of Steel fights evil in the city of Metropolis and beyond. Each episode ends with a short vignette about key events from Kal-El's youth on Earth.,7.1,,778,,DC
493,Too Funny to Fail: The Life & Death of The Dana Carvey Show,(2017),Documentary,92 min,,JoshGreenbaum,"DanaCarvey,RobertSmigel,SteveCarell,StephenColbert","Creators, cast and network executives recount the strange history of the Dana Carvey Show, the irreverent prime time sketch comedy show that aired for eight episodes on ABC, following its star's meteoric run on Saturday Night Live.",7.7,,"1,313",,DC
494,Justice League: Gods and Monsters Chronicles,(2015–2016),"Animation,Short,Action",6 min,,,"TaraStrong,JoshKeaton,BenjaminBratt,MichaelC.Hall","Taking place in an alternate reality featuring their versions of Superman, Wonder Woman, and Batman.",7.7,,"1,177",,DC
495,The Super Powers Team: Galactic Guardians,(1985– ),"Adventure,Animation,Fantasy",30 min,,,"ErnieHudson,CaseyKasem,AdamWest,DannyDark","With the additional help of Cyborg, the greatest DC Comics superheroes continue their battle against the forces of evil.",7.6,,653,,DC
496,Batman: Knightfall,(2022),"Action,Crime,Thriller",,,GaneshKarumuri,"DanielPadilla,MikePrater,JonHarris,EvanMaiorini",The Glorious Pictures or Batman: Knightfall is not affiliated with WB or DC in any manner. Batman: Knightfall is a Realistic CGI non-commercial fan-film being made by The Glorious Pictures ...                See full summary »,,,,,DC
497,LEGO DC Comics Super Heroes: Aquaman - Rage of Atlantis,(2018 Video),"Animation,Action,Adventure",77 min,Not Rated,MattPeters,"JonathanAdams,DeeBradleyBaker,TroyBaker,EricBauza","Aquaman must battle foes in the air, on land and in the depths of the Seven Seas, along with some help from The Justice League, to save the day .",5.7,,848,,DC
498,Challenge of the Superfriends,(1978),"Animation,Action,Family",30 min,TV-Y7,,"JackAngel,MarleneAragon,LewisBailey,MichaelBell","The Justice League of America battles the plots of the supervillian team, the Legion of Doom.",7.7,,"1,500",,DC
499,The Plastic Man Comedy/Adventure Show,(1979– ),"Animation,Adventure,Family",120 min,TV-G,,"JoeBaker,MichaelBell,MelendyBritt,JohnStephenson",The adventures of the original stretchable superhero and various other characters.,6.4,,421,,DC
500,Smallville Season 3 Promo,(2003 TV Short),"Short,Adventure,Drama",4 min,,DavidZimring,omWelling,"A young Clark Kent struggles to find his place in the world as he learns to harness his alien powers for good and deals with the typical troubles of teenage life in Smallville, Kansas. It ...                See full summary »",9.1,,43,,DC
501,Superman Returns,(2006 Video Game),"Action,Adventure,Fantasy",,T,,"BrandonRouth,KateBosworth,KevinSpacey,ParkerPosey","The Man of Steel returns from the extinct planet Kyrpton to his home Metropolis only to find himself protecting it once more from foes such as Metallo, Mongul and Bizarro.",5.5,,"1,038",,DC
502,Swamp Thing,(II) (1990– ),"Animation,Action,Adventure",30 min,,,"LenCarlson,DonFrancks,PhilipAkin,ErrolSlue","Scientist Alec Holland invents a growth substance that could end world hunger, but a plantation owner obsessed with immortality tries to steal it and causes an accident that turns Alec into a human-plant mutant, protector of the bayou.",6.3,,296,,DC
503,SuperFriends: The Legendary Super Powers Show,(1984),"Action,Animation",30 min,,,"MárioJorgeAndrade,JamesAvery,IsaacBardavid,NelsonBatista","Now with the addition of Firestorm, the Super Friends oppose the forces of evil, especially the evil New God, Darkseid.",7.4,,884,,DC
504,The All-New Super Friends Hour,(1977–1978),"Animation,Action,Adventure",60 min,,,"NormanAlden,MichaelBell,DannyDark,ShannonFarnon",A team of the greatest DC Comics superheroes protects Earth with the help of a pair of alien sibling apprentices.,7.2,,"1,569",,DC
505,Robotech: The Shadow Chronicles,(2006),"Animation,Action,Adventure",88 min,PG,"Dong-WookLee,TommyYune","RichardEpcar,EddieFrierson,MarkHamill,AlexandraKenworthy","Picking up where the original series left off, Scott Bernard continues his search for Rick Hunter and the fate of the SDF-3.",6.5,,"1,499",,DC
506,DC Fandome,(2020 TV Special),"Action,Fantasy,Talk-Show",,,,"BenAffleck,WillArnett,TalaAshe,LillyAspell",a Plot,8.7,,75,,DC
507,Green Arrow,(2014),"Animation,Sci-Fi",1 min,,,"WillFriedle,KevinMichaelRichardson,KariWahlgren,KevinConroy",An DC animated shorts following the emerald archer and his super artificial intelligence bow as he takes on crime alongside black canary.,7.7,,278,,DC
508,The Fire Rises: The Creation and Impact of the Dark Knight Trilogy,(2013 Video),Documentary,77 min,,,"EionBailey,ChristianBale,MichaelCaine,NathanCrowley",Documentary about the Dark Knight Trilogy.,8.1,,190,,DC
509,The Omen Legacy,(2001 TV Movie),Documentary,100 min,,BrentZacky,"JackPalance,DavidSeltzer,BlancheBarton,DougPosey","The true stories that spawned the eerie tale of Damien, a small boy with an angelic face, whose very name still conjures up thoughts of Satan. This documentary shares spine-tingling ...                See full summary »",6.7,,292,,DC
510,The World's Greatest SuperFriends,(1979– ),"Adventure,Animation",30 min,TV-Y7,,"MichaelBell,WilliamCallaway,DannyDark,ShannonFarnon",The further and darker adventures of the team consisting of DC Comics' greatest superheroes.,7.5,,708,,DC
511,Necessary Evil: Super-Villains of DC Comics,(2013),Documentary,99 min,Not Rated,"ScottDevine,J.M.Kenny","ChristopherLee,NealAdams,BrianAzzarello,ClaudiaBlack","A documentary detailing the epic Rogues' Gallery of DC Comics from The Joker and Lex Luthor, Sinestro, Darkseid and more, this documentary will explore the Super Villains of DC Comics.",6.8,,"1,128",,DC
512,Dark Justice,(2003),"Short,Action",11 min,,AaronSchoenke,"TanoaiReed,KimHunt,KimWeber,SeanSchoenke","A Batman fan film in which Commissioner Gordon's daughter Barbara is kidnapped by a man he sent to prison 20 years before, and he asks for Batman's help to get her back.",5.9,,140,,DC
513,Frankenpimp,(2009),"Action,Comedy,Fantasy",194 min,,"Vivita,TonyWatt,JohnA.Kelly","TonyWatt,Vivita,MartinMagee,MichelleNewland","Romeo Montague is the alias of (the re-animated) Patient Zero, a skilled, mutated android hit-man/pimp/ancient relics collector, that lives in Verona City, N.Y.; a dystopic metropolis filled with extreme horror and sexual deviancy.",1.1,,145,,DC
514,Superman 50th Anniversary,(1988 TV Movie),"Comedy,Documentary",49 min,,RobertBoyd,"DanaCarvey,KirkAlyn,PeterBoyle,JimmyBreslin",A humorous telling of the history of the comic book superhero.,5.7,,140,,DC
515,Winx Club,(2006 Video Game),"Animation,Action,Adventure",,,,"ors:SpanTitle,DavidCox",Year of manufacture: 2006 Genre: Action / Adventure / For Kids Developer: DC Studios Publisher: Konami Language: Russian and English Language of voice: English Publication Type: Piratka ...                See full summary »,6.8,,18,,DC
516,Teen Titans,(2005 Video Game),"Animation,Action,Adventure",,E10+,,"ScottMenville,KharyPayton,TaraStrong,GregCipes",A video game based on the hit TV show Teen Titans.,7.2,,180,,DC
517,Metropolis,(V),"Action,Crime,Drama",60 min,,,,Metropolis will follow Lois Lane and Lex Luthor as they investigate the world of fringe science and expose the city's dark and bizarre secrets. Airing exclusively on DC's upcoming digital ...                See full summary »,,,,,DC
518,You Will Believe: The Cinematic Saga of Superman,(2006 Video),Documentary,89 min,,,"SamHamm,BobGale,JohnCalley,PeterGuber",a Plot,7.9,,86,,DC
519,Greatest Ever 80s Movies,(2007 TV Movie),Documentary,120 min,,"RubenRay-Choudhuri,TimVanSomeren","GilesCoren,NancyAllen,RogerAllers,RickBaker",a Plot,5.8,,20,,DC
520,100 Bullets,,"Action,Drama,Thriller",,,,,A man offers people who have been wronged an unexpected form of vengeance.,,,,,DC
521,The Science of Superman,(2006 TV Movie),Documentary,51 min,Not Rated,,"RinoRomano,MarkWaid,DennyO'Neil,MarkWolverton","""Science of Superman"" interviews the experts and uses highlights from comic books, television and film - including scenes from the 2006 summer blockbuster, ""Superman Returns"" - to examine ...                See full summary »",7.0,,108,,DC
522,Aquaman: Battle for Atlantis,(2003 Video Game),"Action,Adventure,Fantasy",,,,"ors:JonHilliard,JamieOttilie,JamesRyman,MattSaia","After being presumed dead, Black Manta has returned and intends to destroy kingdom of Atlantis. In order to protect his subjects and the rest of the seven seas, Aquaman must venture into his city, save his people, and defeat Black Manta.",3.5,,81,,DC
523,The Devil You Know: Inside the Mind of Todd McFarlane,(2001),"Documentary,Biography",77 min,,KentonVaughan,"ToddMcFarlane,JimSalicrup",A film about the life and career of the famed Canadian comic book talent.,6.4,,94,,DC
524,Batman,(1991 Video Game),"Action,Fantasy",,,,,a Plot,7.3,,65,,DC
525,First Flight: The Fleischer Superman Series,(2006 Video),"Documentary,Short",13 min,,,"RichardFleischer,LeslieCabarga,JerryBeck,MyronWaldman",Superman leaps off the comic page for the first time in this animated series that ran from 1941-1942.,7.0,,61,,DC
526,DC Nation's Farm League,(2012– ),"Animation,Fantasy,Sci-Fi",1 min,,,"EricBauza,JasonMarsden,LaurenTom,DavidKaye","The adventures of the Justice League on a comedic animal version that includes Bat-Mongoose, Wonder Wombat, and Super-Manatee",6.3,,60,,DC
527,Supergirl: The Making of the Movie,(1984 TV Movie),Documentary,60 min,Unrated,PeterHollywood,"FayeDunaway,PeterO'Toole,TedMaynard,HartBochner","A documentary filmed during production of the film ""Supergirl"" showing the world how and who made it. This interesting featurette includes interviews with the cast and crew along with ...                See full summary »",5.5,,66,,DC
528,The Making of 'Superman III',(1985 TV Movie),Documentary,48 min,,IainJohnstone,"AlMatthews,RoyAlon,JustinCase,ColinChilvers","This documentary treats movie fans to a behind-the-scenes look at the making of Superman III, a more comical take on the superhero story in which the Man of Steel takes on a supercomputer ...                See full summary »",6.1,,78,,DC
529,Project 13,(2018– ),"Action,Crime,Drama",45 min,,,,a Plot,,,,,DC
530,Shadows of the Bat: The Cinematic Saga of the Dark Knight - Dark Side of the Knight,(2005 Video),"Documentary,Short",30 min,,ConstantineNasr,"TimBurton,MichaelKeaton,DeniseDiNovi,SamHamm",An overview of the making of Batman Returns (1992).,7.3,,94,,DC
531,Taking Flight: The Development of 'Superman',(2001 Video),"Documentary,Short",30 min,,MichaelThau,"MarcMcClure,RichardDonner,TomMankiewicz,ChristopherReeve", McClure presents a documentary on the making of Superman (1978).,7.3,,118,,DC
532,Legends of the Dark Knight: The History of Batman,(2005 Video),"Documentary,Short",41 min,,ConstantineNasr,"HarlanEllison,MarkCottaVaz,MichaelE.Uslan,BobKane",A look at the history of the Batman comic franchise.,7.9,,217,,DC
533,Making 'Superman': Filming the Legend,(2001 Video),"Documentary,Short",31 min,,MichaelThau,"MarcMcClure,RichardDonner,TomMankiewicz,ChristopherReeve",a Plot,7.5,,129,,DC
534,Batman Begins: Path to Discovery,(2005 Video),"Documentary,Short",14 min,,,"ChristianBale,ChrisCorbould,NathanCrowley,LarryFranco",A look behind the scenes at the making of Batman Begins (2005).,7.2,,135,,DC
535,Batman: The Journey Begins,(2005 Video),"Documentary,Short",14 min,,,"ChristianBale,NathanCrowley,DavidForman,DavidS.Goyer",An overview of how Batman Begins (2005) was taken from concept to realization.,7.7,,169,,DC
536,The Mythology of Superman,(2006 Video),"Documentary,Short",20 min,,,"TerenceStamp,PaulLevitz,PhilCousineau,BobGale",An exploration of the mythological roots of the Man of Steel.,7.3,,46,,DC
537,Batman Returns Villains: Catwoman,(2005 Video),"Documentary,Short",5 min,,,"MichaelE.Uslan,GeoffJohns,BobKane,AlexRoss",Featurette on Michelle Pfeiffer's character in Batman Returns (1992).,6.6,,31,,DC
538,Batman Heroes: Harvey Dent,(2005 Video),"Documentary,Short",2 min,,,"DanDiDio,RobertWuhl,BillyDeeWilliams",Featurette on Billy Dee Williams' character in Batman (1989).,6.1,,19,,DC
539,The Worst Batman Fanfilm Ever... Period,(2016),"Short,Action,Comedy",3 min,,NikolayYeriomin,"HermannTheRefridgerator,NotExactly,AntonYevtikhov,AskoldTutylopydirskiy","Mr. Freeze, (Not Exactly) Batman and CIA collide in a plotless spoof of a fan film.",7.3,,6,,DC
540,Galaxian,(1979 Video Game),"Action,Sci-Fi",,Unrated,,,Face waves of aliens descending on your spaceship and clear the screen to achieve victory.,7.1,,180,,DC
541,Shadows of the Bat: The Cinematic Saga of the Dark Knight - The Legend Reborn,(2005 Video),"Documentary,Short",31 min,,,"RobertWuhl,MichaelKeaton,JackNicholson,PeterGuber",An overview of the making of the film Batman (1989).,7.6,,91,,DC
542,Batman Villains: Bob the Goon,(2005 Video),"Documentary,Short",2 min,,,"JackNicholson,TraceyWalter",Profile featurette on Tracey Walter's character in Batman (1989).,7.3,,17,,DC
543,Shadows of the Bat: The Cinematic Saga of the Dark Knight - The Gathering Storm,(2005 Video),"Documentary,Short",23 min,,,"TimBurton,JenetteKahn,SamHamm,RobertWuhl",An overview of the development of the film Batman (1989).,7.4,,91,,DC
544,Shaping Mind and Body,(2005 Video),"Documentary,Short",13 min,,,"ChristianBale,DavidForman,PaulJennings,LiamNeeson","How Christian Bale got himself into shape, both physically and mentally, in order to play Batman for the movie Batman Begins (2005).",7.0,,101,,DC
545,The Making of 'Superman: The Movie',(1980 TV Movie),Documentary,52 min,,IainJohnstone,"ErnieAnderson,ChristopherReeve,MarlonBrando,GeneHackman","Ernie Anderson narrates this look at the making of Richard Donner's blockbuster 1978 film. Behind-the-scenes footage, as well as scenes from the film, reveal just how audiences were able to...                See full summary »",7.3,,118,,DC
546,Saving Gotham City,(2005 Video),"Documentary,Short",13 min,,,"StevenBegg,ChrisCorbould,PaulJ.Franklin,KatieHolmes",A look at the effects work for the film Batman Begins (2005).,7.1,,76,,DC
547,From Rivals to Romance: The Making of Lois and Clark,(2005 Video),Short,26 min,,,"RobertButler,DeanCain,KCallan,MikeCarlin",A documentary about the making of Lois & Clark: The New Adventures of Superman (1993).,7.7,,7,,DC
548,Genesis of the Bat,(2005 Video),"Documentary,Short",15 min,,,"DanDiDio,DavidS.Goyer,JimLee,PaulLevitz","A look at the cultural influence of Batman, and the various movie and comic book incarnations of the character, with a specific focus on the film Batman Begins (2005).",7.1,,83,,DC
549,The Magic Behind the Cape,(2001 Video),"Documentary,Short",24 min,,MichaelThau,"RoyField,MarcMcClure,MarlonBrando,RichardDonner",The story of the development of the visual effects used in the first Christopher Reeve Superman film.,7.9,,78,,DC
550,Smallville: Justice and Doom,(2007 TV Movie),"Animation,Sci-Fi",,,,or:RonPerazza,a Plot,6.5,,8,,DC
551,Frank Skinner on Muhammad Ali,(2017 TV Movie),"Documentary,Sport",60 min,,MaryCrisp,"FrankSkinner,NicolaAdams,RahmanAli,LarryHolmes","k Skinner learns more about his sporting hero Muhammad Ali, visiting key locations and people in his life - including the bare knuckle fighter from Oxfordshire who became one of Ali's dear friends.",7.2,,5,,DC
552,Batman: The Tumbler,(2005 Video),"Documentary,Short",14 min,,,"DeanBailey,ChristianBale,ChrisCorbould,GeorgeCottle",An overview of the design process of the Batmobile for the film Batman Begins (2005).,7.4,,138,,DC
553,Batman Returns Villains: The Penguin,(2005 Video),"Documentary,Short",4 min,,,"DannyDeVito,MichaelE.Uslan,TimBurton,MichaelKeaton",Featurette on Danny DeVito's character in Batman Returns (1992).,6.2,,21,,DC
554,"Beyond Batman: Bats, Mattes & Dark Nights - The Visual FX of Batman Returns",(2005 Video),"Documentary,Short",12 min,,ConstantineNasr,"MichaelL.Fink,JohnBruno,CraigBarron",A look at the special effects work on the film Batman Returns (1992).,7.3,,33,,DC
555,"Beyond Batman: Sleek, Sexy and Sinister - The Costumes of Batman Returns",(2005 Video),"Documentary,Short",13 min,,ConstantineNasr,"DeniseDiNovi,TimBurton,MaryE.Vogt,VinBurnham",A look at the costume design for the film Batman Returns (1992).,6.9,,33,,DC
556,Cape and Cowl,(2005 Video),"Documentary,Short",8 min,,,"ChristianBale,GrahamChurchyard,DavidS.Goyer,LindyHemming",A look at how the costumes were created for the movie Batman Begins (2005).,6.8,,98,,DC
557,Wonder Woman: The Ultimate Feminist Icon,(2005 Video),Short,14 min,,,"KarenBerger,LyndaCarter,DawnHeinecken,NinaJaffe",Lynda Carter and four female authors discuss the status of Wonder Woman as a feminist icon.,7.7,,21,,DC
558,The Complete Robin Storyboard Sequence,(2005 Video),"Animation,Short,Action",4 min,,,"KevinConroy,JasonHillhouse,MarkHamill","Reconstruction, using the original storyboard art and with character voiceovers, of the Robin cameo sequence from the Batman (1989) script, which was ultimately never filmed.",7.0,,42,,DC
559,Justice League: Alien Invasion,(2012),"Short,Adventure,Sci-Fi",12 min,,MichaelMinock,"TonyFederico,BetsyGraver,MirandaKhan,TomMulligan",a Plot,8.1,,24,,DC
560,Gotham City Rises,(2005 Video),"Documentary,Short",13 min,,,"ChristianBale,ChrisCorbould,NathanCrowley,LarryFranco",An overview of the production design work for the film Batman Begins (2005).,7.3,,104,,DC
561,Shadows of the Bat: The Cinematic Saga of the Dark Knight - The Road to Gotham City,(2005 Video),"Documentary,Short",18 min,,ConstantineNasr,"PeterGuber,MichaelE.Uslan,MarkCanton,StanLee",A look at how the Batman franchise was revived by the film Batman (1989).,7.5,,91,,DC
562,Beyond Batman: Inside the Elfman Studio - The Music of Batman Returns,(2005 Video),"Documentary,Short,Music",11 min,,ConstantineNasr,"DannyElfman,SteveBartek",A look at the composition of the music for the film Batman Returns (1992).,6.8,,29,,DC
563,Batman Returns Heroes: Alfred,(2005 Video),"Documentary,Short",4 min,,,"DanDiDio,MikeMignola,KevinSmith,MichaelGough",Featurette on Michael Gough's character in Batman Returns (1992).,6.8,,20,,DC
564,DC Fandome - CNN Heroes: Real Life Heroes in the Age of Coronavirus,(2020 TV Special),,,,,ndersonCooper,a Plot,,,,,DC
565,Batman Returns Villains: Max Shreck,(2005 Video),"Documentary,Short",2 min,,,"ChristopherWalken,DanielWaters,MarionDougherty,AlexRoss",Featurette on Christopher Walken's character in Batman Returns (1992).,6.2,,17,,DC
566,Body and Soul,(1984 TV Movie),"Comedy,Family,Music",60 min,,DonMischer,"LyndaCarter,EddieRabbitt,BenVereen,TheWalterPainterDancers",Lynda Carter's fifth variety special.,9.0,,15,,DC
567,Beyond Batman: Making Up the Penguin,(2005 Video),"Documentary,Short",8 min,,ConstantineNasr,"DannyDeVito,StanWinston,TimBurton,Mark'Crash'McCreery",A look at the makeup design for the film Batman Returns (1992).,6.8,,34,,DC
568,The Making of 'Superman II',(1982 TV Movie),Documentary,52 min,,IainJohnstone,"ErnieAnderson,TerenceStamp,GeneHackman,JackO'Halloran",Documentary about the making of the sequel to Superman.,7.0,,85,,DC
569,Batman Returns Heroes: Batman,(2005 Video),"Documentary,Short",3 min,,,"KimNewman,PaulDini,AlexRoss,TimBurton",An overview of the Batman character as portrayed in Batman Returns (1992).,6.5,,21,,DC
570,Film Club,(2002 TV Movie),Documentary,45 min,,CyrusSundarSingh,"CyrusSundarSingh,WilliamLeong,TonyPingitore,MelaneeEng",a Plot,,,,,DC
571,Beyond Batman: Assembling the Arctic Army,(2005 Video),"Documentary,Short",10 min,,ConstantineNasr,"DeniseDiNovi,GaryGero,RichardHill,TimBurton",A look at how the penguin army was filmed during the shooting of Batman Returns (1992).,6.9,,35,,DC
572,Revolutionizing a Classic: From Comic Book to Television - The Evolution of Wonder Woman from Page to Screen,(2005 Video),"Documentary,Short",,,,"LyndaCarter,AndyMangels,PhilJimenez,AlexRoss","A look at the second season of Wonder Woman, when the show moved to CBS and into the 70's.",7.8,,17,,DC
573,Batman Heroes: Vicki Vale,(2005 Video),"Documentary,Short",2 min,,ConstantineNasr,"SamHamm,KimBasinger,TimBurton",Featurette on Kim Basinger's character in the film Batman (1989).,7.0,,21,,DC
574,Superman,(I) (1987 Video Game),"Action,Adventure,Sci-Fi",,,,or:ToshiyukiNishimura,Aliens invade planet Earth and only Superman can save us.,6.3,,38,,DC
575,Batman: Night's End,(2011),Short,15 min,,JamesBoutcher,"JamesBoutcher,MarcelLegault,KelseyGoldberg,AndyLast","Batman seeks Claire Williams, a Wayne Enterprises employee who designed the prototype of new type of hologram who has been reported missing. To rescue her, he must battle his way through a ...                See full summary »",7.4,,10,,DC
576,Guarding the Balance: Batman and the JLA,(2012 Video),Short,19 min,,"AlexanderGray,JeffMaynard","EddieBerganza,StewartDavenport,DanDiDio,BenKarney",a Plot,6.4,,8,,DC
577,Beyond Batman: Gotham City Revisited - The Production Design of Batman Returns,(2005 Video),"Documentary,Short",11 min,,ConstantineNasr,"DeniseDiNovi,BoWelch,TimBurton,TomDuffield",A look at the production design work for the film Batman Returns (1992).,6.8,,33,,DC
578,Shadows of the Bat: The Cinematic Saga of the Dark Knight - Batman Unbound,(2005 Video),"Documentary,Short",27 min,,ConstantineNasr,"GeorgeClooney,JohnGlover,AkivaGoldsman,ValKilmer",a Plot,5.9,,74,,DC
579,Shadows of the Bat: The Cinematic Saga of the Dark Knight - Reinventing a Hero,(2005 Video),"Documentary,Short",28 min,,ConstantineNasr,"JanetScottBatchler,LeeBatchler,JimCarrey,AkivaGoldsman",a Plot,6.6,,66,,DC
580,The Death and Return of Superman,(1994 Video Game),"Action,Adventure,Fantasy",,Unrated,,,"When an unknown monster named Doomsday invades Metropolis, Superman must fight him in an epic and fierce battle to save the city.",7.3,,81,,DC
581,Batman Heroes: Alexander Knox,(2005 Video),"Documentary,Short",2 min,,,"RobertWuhl,JackNicholson",Featurette on Robert Wuhl's character in Batman (1989).,6.2,,17,,DC
582,Batman Heroes: Commissioner Gordon,(2005 Video),"Documentary,Short",2 min,,,"MichaelE.Uslan,PaulDini,PatHingle",Featurette on Pat Hingle's character in Batman (1989).,6.0,,22,,DC
